"No.","Time","Source","Destination","Protocol","Length","Info"
"1","0.000000","192.138.2.3","192.138.1.3","TCP","58","49153  >  2400 [SYN] Seq=0 Win=65535 Len=0 TSval=2000 TSecr=0 WS=4 SACK_PERM=1"
"3","0.015392","192.138.2.3","192.138.1.3","TCP","54","49153  >  2400 [ACK] Seq=1 Ack=1 Win=131072 Len=0 TSval=2017 TSecr=2006"
"4","0.087587","192.138.2.3","192.138.1.3","TCP","590","49153  >  2400 [ACK] Seq=1 Ack=1 Win=131072 Len=536 TSval=2089 TSecr=2006"
"5","0.087771","192.138.2.3","192.138.1.3","TCP","590","49153  >  2400 [ACK] Seq=537 Ack=1 Win=131072 Len=536 TSval=2089 TSecr=2006"
"7","0.088012","192.138.2.3","192.138.1.3","TCP","590","49153  >  2400 [ACK] Seq=1073 Ack=1 Win=131072 Len=536 TSval=2089 TSecr=2006"
"8","0.088284","192.138.2.3","192.138.1.3","TCP","590","49153  >  2400 [ACK] Seq=1609 Ack=1 Win=131072 Len=536 TSval=2089 TSecr=2006"
"10","0.088471","192.138.2.3","192.138.1.3","TCP","590","49153  >  2400 [ACK] Seq=2145 Ack=1 Win=131072 Len=536 TSval=2089 TSecr=2006"
"11","0.088652","192.138.2.3","192.138.1.3","TCP","590","49153  >  2400 [ACK] Seq=2681 Ack=1 Win=131072 Len=536 TSval=2089 TSecr=2006"
"12","0.088834","192.138.2.3","192.138.1.3","TCP","590","49153  >  2400 [ACK] Seq=3217 Ack=1 Win=131072 Len=536 TSval=2089 TSecr=2006"
"13","0.089027","192.138.2.3","192.138.1.3","TCP","590","49153  >  2400 [ACK] Seq=3753 Ack=1 Win=131072 Len=536 TSval=2089 TSecr=2006"
"14","0.089111","192.138.2.3","192.138.1.3","TCP","266","49153  >  2400 [ACK] Seq=4289 Ack=1 Win=131072 Len=212 TSval=2089 TSecr=2006"
"18","0.159587","192.138.2.3","192.138.1.3","TCP","590","49153  >  2400 [ACK] Seq=4501 Ack=1 Win=131072 Len=536 TSval=2161 TSecr=2091"
"19","0.159776","192.138.2.3","192.138.1.3","TCP","590","49153  >  2400 [ACK] Seq=5037 Ack=1 Win=131072 Len=536 TSval=2161 TSecr=2091"
"20","0.159963","192.138.2.3","192.138.1.3","TCP","590","49153  >  2400 [ACK] Seq=5573 Ack=1 Win=131072 Len=536 TSval=2161 TSecr=2091"
"21","0.160158","192.138.2.3","192.138.1.3","TCP","590","49153  >  2400 [ACK] Seq=6109 Ack=1 Win=131072 Len=536 TSval=2161 TSecr=2091"
"22","0.160355","192.138.2.3","192.138.1.3","TCP","590","49153  >  2400 [ACK] Seq=6645 Ack=1 Win=131072 Len=536 TSval=2161 TSecr=2091"
"23","0.160552","192.138.2.3","192.138.1.3","TCP","590","49153  >  2400 [ACK] Seq=7181 Ack=1 Win=131072 Len=536 TSval=2161 TSecr=2091"
"24","0.160753","192.138.2.3","192.138.1.3","TCP","590","49153  >  2400 [ACK] Seq=7717 Ack=1 Win=131072 Len=536 TSval=2161 TSecr=2091"
"26","0.160952","192.138.2.3","192.138.1.3","TCP","590","49153  >  2400 [ACK] Seq=8253 Ack=1 Win=131072 Len=536 TSval=2161 TSecr=2091"
"29","0.161019","192.138.2.3","192.138.1.3","TCP","266","49153  >  2400 [ACK] Seq=8789 Ack=1 Win=131072 Len=212 TSval=2161 TSecr=2091"
"31","0.231587","192.138.2.3","192.138.1.3","TCP","590","49153  >  2400 [ACK] Seq=9001 Ack=1 Win=131072 Len=536 TSval=2233 TSecr=2163"
"32","0.231776","192.138.2.3","192.138.1.3","TCP","590","49153  >  2400 [ACK] Seq=9537 Ack=1 Win=131072 Len=536 TSval=2233 TSecr=2163"
"34","0.231971","192.138.2.3","192.138.1.3","TCP","590","49153  >  2400 [ACK] Seq=10073 Ack=1 Win=131072 Len=536 TSval=2233 TSecr=2163"
"35","0.232213","192.138.2.3","192.138.1.3","TCP","590","49153  >  2400 [ACK] Seq=10609 Ack=1 Win=131072 Len=536 TSval=2233 TSecr=2163"
"37","0.232412","192.138.2.3","192.138.1.3","TCP","590","49153  >  2400 [ACK] Seq=11145 Ack=1 Win=131072 Len=536 TSval=2233 TSecr=2163"
"38","0.232659","192.138.2.3","192.138.1.3","TCP","590","49153  >  2400 [ACK] Seq=11681 Ack=1 Win=131072 Len=536 TSval=2233 TSecr=2163"
"39","0.232841","192.138.2.3","192.138.1.3","TCP","590","49153  >  2400 [ACK] Seq=12217 Ack=1 Win=131072 Len=536 TSval=2233 TSecr=2163"
"40","0.233049","192.138.2.3","192.138.1.3","TCP","590","49153  >  2400 [ACK] Seq=12753 Ack=1 Win=131072 Len=536 TSval=2233 TSecr=2163"
"41","0.233136","192.138.2.3","192.138.1.3","TCP","266","49153  >  2400 [ACK] Seq=13289 Ack=1 Win=131072 Len=212 TSval=2233 TSecr=2163"
"45","0.303587","192.138.2.3","192.138.1.3","TCP","590","49153  >  2400 [ACK] Seq=13501 Ack=1 Win=131072 Len=536 TSval=2305 TSecr=2235"
"46","0.303770","192.138.2.3","192.138.1.3","TCP","590","49153  >  2400 [ACK] Seq=14037 Ack=1 Win=131072 Len=536 TSval=2305 TSecr=2235"
"47","0.303959","192.138.2.3","192.138.1.3","TCP","590","49153  >  2400 [ACK] Seq=14573 Ack=1 Win=131072 Len=536 TSval=2305 TSecr=2235"
"49","0.304146","192.138.2.3","192.138.1.3","TCP","590","49153  >  2400 [ACK] Seq=15109 Ack=1 Win=131072 Len=536 TSval=2305 TSecr=2235"
"50","0.304346","192.138.2.3","192.138.1.3","TCP","590","49153  >  2400 [ACK] Seq=15645 Ack=1 Win=131072 Len=536 TSval=2305 TSecr=2235"
"51","0.304550","192.138.2.3","192.138.1.3","TCP","590","49153  >  2400 [ACK] Seq=16181 Ack=1 Win=131072 Len=536 TSval=2305 TSecr=2235"
"53","0.304745","192.138.2.3","192.138.1.3","TCP","590","49153  >  2400 [ACK] Seq=16717 Ack=1 Win=131072 Len=536 TSval=2305 TSecr=2235"
"54","0.304955","192.138.2.3","192.138.1.3","TCP","590","49153  >  2400 [ACK] Seq=17253 Ack=1 Win=131072 Len=536 TSval=2305 TSecr=2235"
"55","0.305037","192.138.2.3","192.138.1.3","TCP","266","49153  >  2400 [ACK] Seq=17789 Ack=1 Win=131072 Len=212 TSval=2305 TSecr=2235"
"58","0.375587","192.138.2.3","192.138.1.3","TCP","590","49153  >  2400 [ACK] Seq=18001 Ack=1 Win=131072 Len=536 TSval=2377 TSecr=2307"
"59","0.375774","192.138.2.3","192.138.1.3","TCP","590","49153  >  2400 [ACK] Seq=18537 Ack=1 Win=131072 Len=536 TSval=2377 TSecr=2307"
"60","0.375959","192.138.2.3","192.138.1.3","TCP","590","49153  >  2400 [ACK] Seq=19073 Ack=1 Win=131072 Len=536 TSval=2377 TSecr=2307"
"61","0.376158","192.138.2.3","192.138.1.3","TCP","590","49153  >  2400 [ACK] Seq=19609 Ack=1 Win=131072 Len=536 TSval=2377 TSecr=2307"
"62","0.376341","192.138.2.3","192.138.1.3","TCP","590","49153  >  2400 [ACK] Seq=20145 Ack=1 Win=131072 Len=536 TSval=2377 TSecr=2307"
"63","0.376528","192.138.2.3","192.138.1.3","TCP","590","49153  >  2400 [ACK] Seq=20681 Ack=1 Win=131072 Len=536 TSval=2377 TSecr=2307"
"64","0.376714","192.138.2.3","192.138.1.3","TCP","590","49153  >  2400 [ACK] Seq=21217 Ack=1 Win=131072 Len=536 TSval=2377 TSecr=2307"
"65","0.376907","192.138.2.3","192.138.1.3","TCP","590","49153  >  2400 [ACK] Seq=21753 Ack=1 Win=131072 Len=536 TSval=2377 TSecr=2307"
"66","0.376994","192.138.2.3","192.138.1.3","TCP","266","49153  >  2400 [ACK] Seq=22289 Ack=1 Win=131072 Len=212 TSval=2377 TSecr=2307"
"72","0.447587","192.138.2.3","192.138.1.3","TCP","590","49153  >  2400 [ACK] Seq=22501 Ack=1 Win=131072 Len=536 TSval=2449 TSecr=2379"
"73","0.447802","192.138.2.3","192.138.1.3","TCP","590","49153  >  2400 [ACK] Seq=23037 Ack=1 Win=131072 Len=536 TSval=2449 TSecr=2379"
"74","0.448013","192.138.2.3","192.138.1.3","TCP","590","49153  >  2400 [ACK] Seq=23573 Ack=1 Win=131072 Len=536 TSval=2449 TSecr=2379"
"76","0.448213","192.138.2.3","192.138.1.3","TCP","590","49153  >  2400 [ACK] Seq=24109 Ack=1 Win=131072 Len=536 TSval=2449 TSecr=2379"
"77","0.448401","192.138.2.3","192.138.1.3","TCP","590","49153  >  2400 [ACK] Seq=24645 Ack=1 Win=131072 Len=536 TSval=2449 TSecr=2379"
"78","0.448582","192.138.2.3","192.138.1.3","TCP","590","49153  >  2400 [ACK] Seq=25181 Ack=1 Win=131072 Len=536 TSval=2449 TSecr=2379"
"79","0.448781","192.138.2.3","192.138.1.3","TCP","590","49153  >  2400 [ACK] Seq=25717 Ack=1 Win=131072 Len=536 TSval=2449 TSecr=2379"
"80","0.448978","192.138.2.3","192.138.1.3","TCP","590","49153  >  2400 [ACK] Seq=26253 Ack=1 Win=131072 Len=536 TSval=2449 TSecr=2379"
"81","0.449042","192.138.2.3","192.138.1.3","TCP","266","49153  >  2400 [ACK] Seq=26789 Ack=1 Win=131072 Len=212 TSval=2449 TSecr=2379"
"85","0.519587","192.138.2.3","192.138.1.3","TCP","590","49153  >  2400 [ACK] Seq=27001 Ack=1 Win=131072 Len=536 TSval=2521 TSecr=2451"
"86","0.519770","192.138.2.3","192.138.1.3","TCP","590","49153  >  2400 [ACK] Seq=27537 Ack=1 Win=131072 Len=536 TSval=2521 TSecr=2451"
"88","0.519953","192.138.2.3","192.138.1.3","TCP","590","49153  >  2400 [ACK] Seq=28073 Ack=1 Win=131072 Len=536 TSval=2521 TSecr=2451"
"89","0.520148","192.138.2.3","192.138.1.3","TCP","590","49153  >  2400 [ACK] Seq=28609 Ack=1 Win=131072 Len=536 TSval=2521 TSecr=2451"
"90","0.520339","192.138.2.3","192.138.1.3","TCP","590","49153  >  2400 [ACK] Seq=29145 Ack=1 Win=131072 Len=536 TSval=2521 TSecr=2451"
"92","0.520539","192.138.2.3","192.138.1.3","TCP","590","49153  >  2400 [ACK] Seq=29681 Ack=1 Win=131072 Len=536 TSval=2521 TSecr=2451"
"93","0.520737","192.138.2.3","192.138.1.3","TCP","590","49153  >  2400 [ACK] Seq=30217 Ack=1 Win=131072 Len=536 TSval=2521 TSecr=2451"
"94","0.520926","192.138.2.3","192.138.1.3","TCP","590","49153  >  2400 [ACK] Seq=30753 Ack=1 Win=131072 Len=536 TSval=2521 TSecr=2451"
"96","0.521013","192.138.2.3","192.138.1.3","TCP","266","49153  >  2400 [ACK] Seq=31289 Ack=1 Win=131072 Len=212 TSval=2521 TSecr=2451"
"99","0.591587","192.138.2.3","192.138.1.3","TCP","590","49153  >  2400 [ACK] Seq=31501 Ack=1 Win=131072 Len=536 TSval=2593 TSecr=2523"
"100","0.591772","192.138.2.3","192.138.1.3","TCP","590","49153  >  2400 [ACK] Seq=32037 Ack=1 Win=131072 Len=536 TSval=2593 TSecr=2523"
"101","0.591974","192.138.2.3","192.138.1.3","TCP","590","49153  >  2400 [ACK] Seq=32573 Ack=1 Win=131072 Len=536 TSval=2593 TSecr=2523"
"103","0.592186","192.138.2.3","192.138.1.3","TCP","590","49153  >  2400 [ACK] Seq=33109 Ack=1 Win=131072 Len=536 TSval=2593 TSecr=2523"
"104","0.592433","192.138.2.3","192.138.1.3","TCP","590","49153  >  2400 [ACK] Seq=33645 Ack=1 Win=131072 Len=536 TSval=2593 TSecr=2523"
"106","0.592647","192.138.2.3","192.138.1.3","TCP","590","49153  >  2400 [ACK] Seq=34181 Ack=1 Win=131072 Len=536 TSval=2593 TSecr=2523"
"107","0.592920","192.138.2.3","192.138.1.3","TCP","590","49153  >  2400 [ACK] Seq=34717 Ack=1 Win=131072 Len=536 TSval=2593 TSecr=2523"
"109","0.593121","192.138.2.3","192.138.1.3","TCP","590","49153  >  2400 [ACK] Seq=35253 Ack=1 Win=131072 Len=536 TSval=2593 TSecr=2523"
"110","0.593184","192.138.2.3","192.138.1.3","TCP","266","49153  >  2400 [ACK] Seq=35789 Ack=1 Win=131072 Len=212 TSval=2593 TSecr=2523"
"112","0.663587","192.138.2.3","192.138.1.3","TCP","590","49153  >  2400 [ACK] Seq=36001 Ack=1 Win=131072 Len=536 TSval=2665 TSecr=2595"
"113","0.663787","192.138.2.3","192.138.1.3","TCP","590","49153  >  2400 [ACK] Seq=36537 Ack=1 Win=131072 Len=536 TSval=2665 TSecr=2595"
"115","0.663977","192.138.2.3","192.138.1.3","TCP","590","49153  >  2400 [ACK] Seq=37073 Ack=1 Win=131072 Len=536 TSval=2665 TSecr=2595"
"116","0.664213","192.138.2.3","192.138.1.3","TCP","590","49153  >  2400 [ACK] Seq=37609 Ack=1 Win=131072 Len=536 TSval=2665 TSecr=2595"
"118","0.664432","192.138.2.3","192.138.1.3","TCP","590","49153  >  2400 [ACK] Seq=38145 Ack=1 Win=131072 Len=536 TSval=2665 TSecr=2595"
"119","0.664697","192.138.2.3","192.138.1.3","TCP","590","49153  >  2400 [ACK] Seq=38681 Ack=1 Win=131072 Len=536 TSval=2665 TSecr=2595"
"120","0.664899","192.138.2.3","192.138.1.3","TCP","590","49153  >  2400 [ACK] Seq=39217 Ack=1 Win=131072 Len=536 TSval=2665 TSecr=2595"
"122","0.665126","192.138.2.3","192.138.1.3","TCP","590","49153  >  2400 [ACK] Seq=39753 Ack=1 Win=131072 Len=536 TSval=2665 TSecr=2595"
"123","0.665237","192.138.2.3","192.138.1.3","TCP","266","49153  >  2400 [ACK] Seq=40289 Ack=1 Win=131072 Len=212 TSval=2665 TSecr=2595"
"126","0.735587","192.138.2.3","192.138.1.3","TCP","590","49153  >  2400 [ACK] Seq=40501 Ack=1 Win=131072 Len=536 TSval=2737 TSecr=2667"
"127","0.735769","192.138.2.3","192.138.1.3","TCP","590","49153  >  2400 [ACK] Seq=41037 Ack=1 Win=131072 Len=536 TSval=2737 TSecr=2667"
"128","0.735957","192.138.2.3","192.138.1.3","TCP","590","49153  >  2400 [ACK] Seq=41573 Ack=1 Win=131072 Len=536 TSval=2737 TSecr=2667"
"130","0.736146","192.138.2.3","192.138.1.3","TCP","590","49153  >  2400 [ACK] Seq=42109 Ack=1 Win=131072 Len=536 TSval=2737 TSecr=2667"
"131","0.736334","192.138.2.3","192.138.1.3","TCP","590","49153  >  2400 [ACK] Seq=42645 Ack=1 Win=131072 Len=536 TSval=2737 TSecr=2667"
"132","0.736527","192.138.2.3","192.138.1.3","TCP","590","49153  >  2400 [ACK] Seq=43181 Ack=1 Win=131072 Len=536 TSval=2737 TSecr=2667"
"134","0.736709","192.138.2.3","192.138.1.3","TCP","590","49153  >  2400 [ACK] Seq=43717 Ack=1 Win=131072 Len=536 TSval=2737 TSecr=2667"
"135","0.736891","192.138.2.3","192.138.1.3","TCP","590","49153  >  2400 [ACK] Seq=44253 Ack=1 Win=131072 Len=536 TSval=2737 TSecr=2667"
"136","0.736957","192.138.2.3","192.138.1.3","TCP","266","49153  >  2400 [ACK] Seq=44789 Ack=1 Win=131072 Len=212 TSval=2737 TSecr=2667"
"139","0.807587","192.138.2.3","192.138.1.3","TCP","590","49153  >  2400 [ACK] Seq=45001 Ack=1 Win=131072 Len=536 TSval=2809 TSecr=2739"
"140","0.807772","192.138.2.3","192.138.1.3","TCP","590","49153  >  2400 [ACK] Seq=45537 Ack=1 Win=131072 Len=536 TSval=2809 TSecr=2739"
"141","0.807972","192.138.2.3","192.138.1.3","TCP","590","49153  >  2400 [ACK] Seq=46073 Ack=1 Win=131072 Len=536 TSval=2809 TSecr=2739"
"142","0.808155","192.138.2.3","192.138.1.3","TCP","590","49153  >  2400 [ACK] Seq=46609 Ack=1 Win=131072 Len=536 TSval=2809 TSecr=2739"
"143","0.808350","192.138.2.3","192.138.1.3","TCP","590","49153  >  2400 [ACK] Seq=47145 Ack=1 Win=131072 Len=536 TSval=2809 TSecr=2739"
"144","0.808549","192.138.2.3","192.138.1.3","TCP","590","49153  >  2400 [ACK] Seq=47681 Ack=1 Win=131072 Len=536 TSval=2809 TSecr=2739"
"145","0.808732","192.138.2.3","192.138.1.3","TCP","590","49153  >  2400 [ACK] Seq=48217 Ack=1 Win=131072 Len=536 TSval=2809 TSecr=2739"
"146","0.808938","192.138.2.3","192.138.1.3","TCP","590","49153  >  2400 [ACK] Seq=48753 Ack=1 Win=131072 Len=536 TSval=2809 TSecr=2739"
"147","0.809004","192.138.2.3","192.138.1.3","TCP","266","49153  >  2400 [ACK] Seq=49289 Ack=1 Win=131072 Len=212 TSval=2809 TSecr=2739"
"153","0.879587","192.138.2.3","192.138.1.3","TCP","590","49153  >  2400 [ACK] Seq=49501 Ack=1 Win=131072 Len=536 TSval=2881 TSecr=2811"
"154","0.879769","192.138.2.3","192.138.1.3","TCP","590","49153  >  2400 [ACK] Seq=50037 Ack=1 Win=131072 Len=536 TSval=2881 TSecr=2811"
"155","0.879956","192.138.2.3","192.138.1.3","TCP","590","49153  >  2400 [ACK] Seq=50573 Ack=1 Win=131072 Len=536 TSval=2881 TSecr=2811"
"157","0.880142","192.138.2.3","192.138.1.3","TCP","590","49153  >  2400 [ACK] Seq=51109 Ack=1 Win=131072 Len=536 TSval=2881 TSecr=2811"
"158","0.880325","192.138.2.3","192.138.1.3","TCP","590","49153  >  2400 [ACK] Seq=51645 Ack=1 Win=131072 Len=536 TSval=2881 TSecr=2811"
"159","0.880506","192.138.2.3","192.138.1.3","TCP","590","49153  >  2400 [ACK] Seq=52181 Ack=1 Win=131072 Len=536 TSval=2881 TSecr=2811"
"161","0.880699","192.138.2.3","192.138.1.3","TCP","590","49153  >  2400 [ACK] Seq=52717 Ack=1 Win=131072 Len=536 TSval=2881 TSecr=2811"
"162","0.880906","192.138.2.3","192.138.1.3","TCP","590","49153  >  2400 [ACK] Seq=53253 Ack=1 Win=131072 Len=536 TSval=2881 TSecr=2811"
"163","0.881010","192.138.2.3","192.138.1.3","TCP","266","49153  >  2400 [ACK] Seq=53789 Ack=1 Win=131072 Len=212 TSval=2881 TSecr=2811"
"166","0.951587","192.138.2.3","192.138.1.3","TCP","590","49153  >  2400 [ACK] Seq=54001 Ack=1 Win=131072 Len=536 TSval=2953 TSecr=2883"
"167","0.951772","192.138.2.3","192.138.1.3","TCP","590","49153  >  2400 [ACK] Seq=54537 Ack=1 Win=131072 Len=536 TSval=2953 TSecr=2883"
"169","0.951977","192.138.2.3","192.138.1.3","TCP","590","49153  >  2400 [ACK] Seq=55073 Ack=1 Win=131072 Len=536 TSval=2953 TSecr=2883"
"170","0.952223","192.138.2.3","192.138.1.3","TCP","590","49153  >  2400 [ACK] Seq=55609 Ack=1 Win=131072 Len=536 TSval=2953 TSecr=2883"
"172","0.952406","192.138.2.3","192.138.1.3","TCP","590","49153  >  2400 [ACK] Seq=56145 Ack=1 Win=131072 Len=536 TSval=2953 TSecr=2883"
"173","0.952601","192.138.2.3","192.138.1.3","TCP","590","49153  >  2400 [ACK] Seq=56681 Ack=1 Win=131072 Len=536 TSval=2953 TSecr=2883"
"174","0.952784","192.138.2.3","192.138.1.3","TCP","590","49153  >  2400 [ACK] Seq=57217 Ack=1 Win=131072 Len=536 TSval=2953 TSecr=2883"
"176","0.952981","192.138.2.3","192.138.1.3","TCP","590","49153  >  2400 [ACK] Seq=57753 Ack=1 Win=131072 Len=536 TSval=2953 TSecr=2883"
"177","0.953049","192.138.2.3","192.138.1.3","TCP","266","49153  >  2400 [ACK] Seq=58289 Ack=1 Win=131072 Len=212 TSval=2953 TSecr=2883"
"180","1.023589","192.138.2.3","192.138.1.3","TCP","590","49153  >  2400 [ACK] Seq=58501 Ack=1 Win=131072 Len=536 TSval=3025 TSecr=2955"
"181","1.023776","192.138.2.3","192.138.1.3","TCP","590","49153  >  2400 [ACK] Seq=59037 Ack=1 Win=131072 Len=536 TSval=3025 TSecr=2955"
"182","1.023963","192.138.2.3","192.138.1.3","TCP","590","49153  >  2400 [ACK] Seq=59573 Ack=1 Win=131072 Len=536 TSval=3025 TSecr=2955"
"184","1.024159","192.138.2.3","192.138.1.3","TCP","590","49153  >  2400 [ACK] Seq=60109 Ack=1 Win=131072 Len=536 TSval=3025 TSecr=2955"
"185","1.024360","192.138.2.3","192.138.1.3","TCP","590","49153  >  2400 [ACK] Seq=60645 Ack=1 Win=131072 Len=536 TSval=3025 TSecr=2955"
"186","1.024543","192.138.2.3","192.138.1.3","TCP","590","49153  >  2400 [ACK] Seq=61181 Ack=1 Win=131072 Len=536 TSval=3025 TSecr=2955"
"187","1.024730","192.138.2.3","192.138.1.3","TCP","590","49153  >  2400 [ACK] Seq=61717 Ack=1 Win=131072 Len=536 TSval=3025 TSecr=2955"
"188","1.024912","192.138.2.3","192.138.1.3","TCP","590","49153  >  2400 [ACK] Seq=62253 Ack=1 Win=131072 Len=536 TSval=3025 TSecr=2955"
"189","1.024982","192.138.2.3","192.138.1.3","TCP","266","49153  >  2400 [ACK] Seq=62789 Ack=1 Win=131072 Len=212 TSval=3025 TSecr=2955"
"193","1.095589","192.138.2.3","192.138.1.3","TCP","590","49153  >  2400 [ACK] Seq=63001 Ack=1 Win=131072 Len=536 TSval=3097 TSecr=3027"
"194","1.095772","192.138.2.3","192.138.1.3","TCP","590","49153  >  2400 [ACK] Seq=63537 Ack=1 Win=131072 Len=536 TSval=3097 TSecr=3027"
"195","1.095959","192.138.2.3","192.138.1.3","TCP","590","49153  >  2400 [ACK] Seq=64073 Ack=1 Win=131072 Len=536 TSval=3097 TSecr=3027"
"196","1.096192","192.138.2.3","192.138.1.3","TCP","590","49153  >  2400 [ACK] Seq=64609 Ack=1 Win=131072 Len=536 TSval=3097 TSecr=3027"
"197","1.096391","192.138.2.3","192.138.1.3","TCP","590","49153  >  2400 [ACK] Seq=65145 Ack=1 Win=131072 Len=536 TSval=3097 TSecr=3027"
"198","1.096573","192.138.2.3","192.138.1.3","TCP","590","49153  >  2400 [ACK] Seq=65681 Ack=1 Win=131072 Len=536 TSval=3097 TSecr=3027"
"199","1.096755","192.138.2.3","192.138.1.3","TCP","590","49153  >  2400 [ACK] Seq=66217 Ack=1 Win=131072 Len=536 TSval=3097 TSecr=3027"
"200","1.096940","192.138.2.3","192.138.1.3","TCP","590","49153  >  2400 [ACK] Seq=66753 Ack=1 Win=131072 Len=536 TSval=3097 TSecr=3027"
"201","1.097003","192.138.2.3","192.138.1.3","TCP","266","49153  >  2400 [ACK] Seq=67289 Ack=1 Win=131072 Len=212 TSval=3097 TSecr=3027"
"207","1.167589","192.138.2.3","192.138.1.3","TCP","590","49153  >  2400 [ACK] Seq=67501 Ack=1 Win=131072 Len=536 TSval=3169 TSecr=3099"
"208","1.167772","192.138.2.3","192.138.1.3","TCP","590","49153  >  2400 [ACK] Seq=68037 Ack=1 Win=131072 Len=536 TSval=3169 TSecr=3099"
"209","1.167955","192.138.2.3","192.138.1.3","TCP","590","49153  >  2400 [ACK] Seq=68573 Ack=1 Win=131072 Len=536 TSval=3169 TSecr=3099"
"210","1.168139","192.138.2.3","192.138.1.3","TCP","590","49153  >  2400 [ACK] Seq=69109 Ack=1 Win=131072 Len=536 TSval=3169 TSecr=3099"
"211","1.168324","192.138.2.3","192.138.1.3","TCP","590","49153  >  2400 [ACK] Seq=69645 Ack=1 Win=131072 Len=536 TSval=3169 TSecr=3099"
"212","1.168512","192.138.2.3","192.138.1.3","TCP","590","49153  >  2400 [ACK] Seq=70181 Ack=1 Win=131072 Len=536 TSval=3169 TSecr=3099"
"213","1.168696","192.138.2.3","192.138.1.3","TCP","590","49153  >  2400 [ACK] Seq=70717 Ack=1 Win=131072 Len=536 TSval=3169 TSecr=3099"
"214","1.168878","192.138.2.3","192.138.1.3","TCP","590","49153  >  2400 [ACK] Seq=71253 Ack=1 Win=131072 Len=536 TSval=3169 TSecr=3099"
"215","1.168961","192.138.2.3","192.138.1.3","TCP","266","49153  >  2400 [ACK] Seq=71789 Ack=1 Win=131072 Len=212 TSval=3169 TSecr=3099"
"220","1.239589","192.138.2.3","192.138.1.3","TCP","590","49153  >  2400 [ACK] Seq=72001 Ack=1 Win=131072 Len=536 TSval=3241 TSecr=3171"
"221","1.239790","192.138.2.3","192.138.1.3","TCP","590","49153  >  2400 [ACK] Seq=72537 Ack=1 Win=131072 Len=536 TSval=3241 TSecr=3171"
"223","1.239978","192.138.2.3","192.138.1.3","TCP","590","49153  >  2400 [ACK] Seq=73073 Ack=1 Win=131072 Len=536 TSval=3241 TSecr=3171"
"224","1.240160","192.138.2.3","192.138.1.3","TCP","590","49153  >  2400 [ACK] Seq=73609 Ack=1 Win=131072 Len=536 TSval=3241 TSecr=3171"
"225","1.240344","192.138.2.3","192.138.1.3","TCP","590","49153  >  2400 [ACK] Seq=74145 Ack=1 Win=131072 Len=536 TSval=3241 TSecr=3171"
"227","1.240774","192.138.2.3","192.138.1.3","TCP","590","49153  >  2400 [ACK] Seq=74681 Ack=1 Win=131072 Len=536 TSval=3241 TSecr=3171"
"229","1.240957","192.138.2.3","192.138.1.3","TCP","590","49153  >  2400 [ACK] Seq=75217 Ack=1 Win=131072 Len=536 TSval=3241 TSecr=3171"
"230","1.241248","192.138.2.3","192.138.1.3","TCP","590","49153  >  2400 [ACK] Seq=75753 Ack=1 Win=131072 Len=536 TSval=3241 TSecr=3171"
"232","1.241323","192.138.2.3","192.138.1.3","TCP","266","49153  >  2400 [ACK] Seq=76289 Ack=1 Win=131072 Len=212 TSval=3241 TSecr=3171"
"234","1.311589","192.138.2.3","192.138.1.3","TCP","590","49153  >  2400 [ACK] Seq=76501 Ack=1 Win=131072 Len=536 TSval=3313 TSecr=3243"
"235","1.311772","192.138.2.3","192.138.1.3","TCP","590","49153  >  2400 [ACK] Seq=77037 Ack=1 Win=131072 Len=536 TSval=3313 TSecr=3243"
"236","1.311961","192.138.2.3","192.138.1.3","TCP","590","49153  >  2400 [ACK] Seq=77573 Ack=1 Win=131072 Len=536 TSval=3313 TSecr=3243"
"237","1.312156","192.138.2.3","192.138.1.3","TCP","590","49153  >  2400 [ACK] Seq=78109 Ack=1 Win=131072 Len=536 TSval=3313 TSecr=3243"
"238","1.312355","192.138.2.3","192.138.1.3","TCP","590","49153  >  2400 [ACK] Seq=78645 Ack=1 Win=131072 Len=536 TSval=3313 TSecr=3243"
"239","1.312539","192.138.2.3","192.138.1.3","TCP","590","49153  >  2400 [ACK] Seq=79181 Ack=1 Win=131072 Len=536 TSval=3313 TSecr=3243"
"240","1.312726","192.138.2.3","192.138.1.3","TCP","590","49153  >  2400 [ACK] Seq=79717 Ack=1 Win=131072 Len=536 TSval=3313 TSecr=3243"
"241","1.312911","192.138.2.3","192.138.1.3","TCP","590","49153  >  2400 [ACK] Seq=80253 Ack=1 Win=131072 Len=536 TSval=3313 TSecr=3243"
"242","1.312974","192.138.2.3","192.138.1.3","TCP","266","49153  >  2400 [ACK] Seq=80789 Ack=1 Win=131072 Len=212 TSval=3313 TSecr=3243"
"247","1.383589","192.138.2.3","192.138.1.3","TCP","590","49153  >  2400 [ACK] Seq=81001 Ack=1 Win=131072 Len=536 TSval=3385 TSecr=3315"
"248","1.383771","192.138.2.3","192.138.1.3","TCP","590","49153  >  2400 [ACK] Seq=81537 Ack=1 Win=131072 Len=536 TSval=3385 TSecr=3315"
"250","1.383957","192.138.2.3","192.138.1.3","TCP","590","49153  >  2400 [ACK] Seq=82073 Ack=1 Win=131072 Len=536 TSval=3385 TSecr=3315"
"251","1.384149","192.138.2.3","192.138.1.3","TCP","590","49153  >  2400 [ACK] Seq=82609 Ack=1 Win=131072 Len=536 TSval=3385 TSecr=3315"
"252","1.384392","192.138.2.3","192.138.1.3","TCP","590","49153  >  2400 [ACK] Seq=83145 Ack=1 Win=131072 Len=536 TSval=3385 TSecr=3315"
"254","1.384574","192.138.2.3","192.138.1.3","TCP","590","49153  >  2400 [ACK] Seq=83681 Ack=1 Win=131072 Len=536 TSval=3385 TSecr=3315"
"255","1.384758","192.138.2.3","192.138.1.3","TCP","590","49153  >  2400 [ACK] Seq=84217 Ack=1 Win=131072 Len=536 TSval=3385 TSecr=3315"
"256","1.384943","192.138.2.3","192.138.1.3","TCP","590","49153  >  2400 [ACK] Seq=84753 Ack=1 Win=131072 Len=536 TSval=3385 TSecr=3315"
"257","1.385028","192.138.2.3","192.138.1.3","TCP","266","49153  >  2400 [ACK] Seq=85289 Ack=1 Win=131072 Len=212 TSval=3385 TSecr=3315"
"261","1.455589","192.138.2.3","192.138.1.3","TCP","590","49153  >  2400 [ACK] Seq=85501 Ack=1 Win=131072 Len=536 TSval=3457 TSecr=3387"
"262","1.455774","192.138.2.3","192.138.1.3","TCP","590","49153  >  2400 [ACK] Seq=86037 Ack=1 Win=131072 Len=536 TSval=3457 TSecr=3387"
"263","1.455975","192.138.2.3","192.138.1.3","TCP","590","49153  >  2400 [ACK] Seq=86573 Ack=1 Win=131072 Len=536 TSval=3457 TSecr=3387"
"264","1.456157","192.138.2.3","192.138.1.3","TCP","590","49153  >  2400 [ACK] Seq=87109 Ack=1 Win=131072 Len=536 TSval=3457 TSecr=3387"
"265","1.456360","192.138.2.3","192.138.1.3","TCP","590","49153  >  2400 [ACK] Seq=87645 Ack=1 Win=131072 Len=536 TSval=3457 TSecr=3387"
"266","1.456549","192.138.2.3","192.138.1.3","TCP","590","49153  >  2400 [ACK] Seq=88181 Ack=1 Win=131072 Len=536 TSval=3457 TSecr=3387"
"267","1.456735","192.138.2.3","192.138.1.3","TCP","590","49153  >  2400 [ACK] Seq=88717 Ack=1 Win=131072 Len=536 TSval=3457 TSecr=3387"
"268","1.456941","192.138.2.3","192.138.1.3","TCP","590","49153  >  2400 [ACK] Seq=89253 Ack=1 Win=131072 Len=536 TSval=3457 TSecr=3387"
"269","1.457011","192.138.2.3","192.138.1.3","TCP","266","49153  >  2400 [ACK] Seq=89789 Ack=1 Win=131072 Len=212 TSval=3457 TSecr=3387"
"274","1.527589","192.138.2.3","192.138.1.3","TCP","590","49153  >  2400 [ACK] Seq=90001 Ack=1 Win=131072 Len=536 TSval=3529 TSecr=3459"
"275","1.527793","192.138.2.3","192.138.1.3","TCP","590","49153  >  2400 [ACK] Seq=90537 Ack=1 Win=131072 Len=536 TSval=3529 TSecr=3459"
"276","1.527985","192.138.2.3","192.138.1.3","TCP","590","49153  >  2400 [ACK] Seq=91073 Ack=1 Win=131072 Len=536 TSval=3529 TSecr=3459"
"277","1.528192","192.138.2.3","192.138.1.3","TCP","590","49153  >  2400 [ACK] Seq=91609 Ack=1 Win=131072 Len=536 TSval=3529 TSecr=3459"
"278","1.528387","192.138.2.3","192.138.1.3","TCP","590","49153  >  2400 [ACK] Seq=92145 Ack=1 Win=131072 Len=536 TSval=3529 TSecr=3459"
"279","1.528609","192.138.2.3","192.138.1.3","TCP","590","49153  >  2400 [ACK] Seq=92681 Ack=1 Win=131072 Len=536 TSval=3529 TSecr=3459"
"280","1.528817","192.138.2.3","192.138.1.3","TCP","590","49153  >  2400 [ACK] Seq=93217 Ack=1 Win=131072 Len=536 TSval=3529 TSecr=3459"
"281","1.529004","192.138.2.3","192.138.1.3","TCP","590","49153  >  2400 [ACK] Seq=93753 Ack=1 Win=131072 Len=536 TSval=3529 TSecr=3459"
"282","1.529079","192.138.2.3","192.138.1.3","TCP","266","49153  >  2400 [ACK] Seq=94289 Ack=1 Win=131072 Len=212 TSval=3529 TSecr=3459"
"288","1.599589","192.138.2.3","192.138.1.3","TCP","590","49153  >  2400 [ACK] Seq=94501 Ack=1 Win=131072 Len=536 TSval=3601 TSecr=3531"
"289","1.599797","192.138.2.3","192.138.1.3","TCP","590","49153  >  2400 [ACK] Seq=95037 Ack=1 Win=131072 Len=536 TSval=3601 TSecr=3531"
"290","1.599982","192.138.2.3","192.138.1.3","TCP","590","49153  >  2400 [ACK] Seq=95573 Ack=1 Win=131072 Len=536 TSval=3601 TSecr=3531"
"292","1.600171","192.138.2.3","192.138.1.3","TCP","590","49153  >  2400 [ACK] Seq=96109 Ack=1 Win=131072 Len=536 TSval=3601 TSecr=3531"
"293","1.600353","192.138.2.3","192.138.1.3","TCP","590","49153  >  2400 [ACK] Seq=96645 Ack=1 Win=131072 Len=536 TSval=3601 TSecr=3531"
"294","1.600538","192.138.2.3","192.138.1.3","TCP","590","49153  >  2400 [ACK] Seq=97181 Ack=1 Win=131072 Len=536 TSval=3601 TSecr=3531"
"296","1.600743","192.138.2.3","192.138.1.3","TCP","590","49153  >  2400 [ACK] Seq=97717 Ack=1 Win=131072 Len=536 TSval=3601 TSecr=3531"
"297","1.600927","192.138.2.3","192.138.1.3","TCP","590","49153  >  2400 [ACK] Seq=98253 Ack=1 Win=131072 Len=536 TSval=3601 TSecr=3531"
"298","1.600999","192.138.2.3","192.138.1.3","TCP","266","49153  >  2400 [ACK] Seq=98789 Ack=1 Win=131072 Len=212 TSval=3601 TSecr=3531"
"301","1.671589","192.138.2.3","192.138.1.3","TCP","590","49153  >  2400 [ACK] Seq=99001 Ack=1 Win=131072 Len=536 TSval=3673 TSecr=3603"
"302","1.671791","192.138.2.3","192.138.1.3","TCP","590","49153  >  2400 [ACK] Seq=99537 Ack=1 Win=131072 Len=536 TSval=3673 TSecr=3603"
"303","1.671976","192.138.2.3","192.138.1.3","TCP","590","49153  >  2400 [ACK] Seq=100073 Ack=1 Win=131072 Len=536 TSval=3673 TSecr=3603"
"304","1.672165","192.138.2.3","192.138.1.3","TCP","590","49153  >  2400 [ACK] Seq=100609 Ack=1 Win=131072 Len=536 TSval=3673 TSecr=3603"
"305","1.672360","192.138.2.3","192.138.1.3","TCP","590","49153  >  2400 [ACK] Seq=101145 Ack=1 Win=131072 Len=536 TSval=3673 TSecr=3603"
"306","1.672563","192.138.2.3","192.138.1.3","TCP","590","49153  >  2400 [ACK] Seq=101681 Ack=1 Win=131072 Len=536 TSval=3673 TSecr=3603"
"307","1.672755","192.138.2.3","192.138.1.3","TCP","590","49153  >  2400 [ACK] Seq=102217 Ack=1 Win=131072 Len=536 TSval=3673 TSecr=3603"
"308","1.672956","192.138.2.3","192.138.1.3","TCP","590","49153  >  2400 [ACK] Seq=102753 Ack=1 Win=131072 Len=536 TSval=3673 TSecr=3603"
"309","1.673029","192.138.2.3","192.138.1.3","TCP","266","49153  >  2400 [ACK] Seq=103289 Ack=1 Win=131072 Len=212 TSval=3673 TSecr=3603"
"315","1.743589","192.138.2.3","192.138.1.3","TCP","590","49153  >  2400 [ACK] Seq=103501 Ack=1 Win=131072 Len=536 TSval=3745 TSecr=3675"
"316","1.743774","192.138.2.3","192.138.1.3","TCP","590","49153  >  2400 [ACK] Seq=104037 Ack=1 Win=131072 Len=536 TSval=3745 TSecr=3675"
"317","1.743973","192.138.2.3","192.138.1.3","TCP","590","49153  >  2400 [ACK] Seq=104573 Ack=1 Win=131072 Len=536 TSval=3745 TSecr=3675"
"318","1.744172","192.138.2.3","192.138.1.3","TCP","590","49153  >  2400 [ACK] Seq=105109 Ack=1 Win=131072 Len=536 TSval=3745 TSecr=3675"
"320","1.744359","192.138.2.3","192.138.1.3","TCP","590","49153  >  2400 [ACK] Seq=105645 Ack=1 Win=131072 Len=536 TSval=3745 TSecr=3675"
"321","1.744548","192.138.2.3","192.138.1.3","TCP","590","49153  >  2400 [ACK] Seq=106181 Ack=1 Win=131072 Len=536 TSval=3745 TSecr=3675"
"323","1.744732","192.138.2.3","192.138.1.3","TCP","590","49153  >  2400 [ACK] Seq=106717 Ack=1 Win=131072 Len=536 TSval=3745 TSecr=3675"
"324","1.744934","192.138.2.3","192.138.1.3","TCP","590","49153  >  2400 [ACK] Seq=107253 Ack=1 Win=131072 Len=536 TSval=3745 TSecr=3675"
"325","1.744998","192.138.2.3","192.138.1.3","TCP","266","49153  >  2400 [ACK] Seq=107789 Ack=1 Win=131072 Len=212 TSval=3745 TSecr=3675"
"328","1.815589","192.138.2.3","192.138.1.3","TCP","590","49153  >  2400 [ACK] Seq=108001 Ack=1 Win=131072 Len=536 TSval=3817 TSecr=3747"
"329","1.815773","192.138.2.3","192.138.1.3","TCP","590","49153  >  2400 [ACK] Seq=108537 Ack=1 Win=131072 Len=536 TSval=3817 TSecr=3747"
"331","1.815978","192.138.2.3","192.138.1.3","TCP","590","49153  >  2400 [ACK] Seq=109073 Ack=1 Win=131072 Len=536 TSval=3817 TSecr=3747"
"332","1.816236","192.138.2.3","192.138.1.3","TCP","590","49153  >  2400 [ACK] Seq=109609 Ack=1 Win=131072 Len=536 TSval=3817 TSecr=3747"
"334","1.816421","192.138.2.3","192.138.1.3","TCP","590","49153  >  2400 [ACK] Seq=110145 Ack=1 Win=131072 Len=536 TSval=3817 TSecr=3747"
"335","1.816617","192.138.2.3","192.138.1.3","TCP","590","49153  >  2400 [ACK] Seq=110681 Ack=1 Win=131072 Len=536 TSval=3817 TSecr=3747"
"336","1.816807","192.138.2.3","192.138.1.3","TCP","590","49153  >  2400 [ACK] Seq=111217 Ack=1 Win=131072 Len=536 TSval=3817 TSecr=3747"
"338","1.816991","192.138.2.3","192.138.1.3","TCP","590","49153  >  2400 [ACK] Seq=111753 Ack=1 Win=131072 Len=536 TSval=3817 TSecr=3747"
"339","1.817072","192.138.2.3","192.138.1.3","TCP","266","49153  >  2400 [ACK] Seq=112289 Ack=1 Win=131072 Len=212 TSval=3817 TSecr=3747"
"342","1.887589","192.138.2.3","192.138.1.3","TCP","590","49153  >  2400 [ACK] Seq=112501 Ack=1 Win=131072 Len=536 TSval=3889 TSecr=3819"
"343","1.887774","192.138.2.3","192.138.1.3","TCP","590","49153  >  2400 [ACK] Seq=113037 Ack=1 Win=131072 Len=536 TSval=3889 TSecr=3819"
"344","1.887979","192.138.2.3","192.138.1.3","TCP","590","49153  >  2400 [ACK] Seq=113573 Ack=1 Win=131072 Len=536 TSval=3889 TSecr=3819"
"345","1.888186","192.138.2.3","192.138.1.3","TCP","590","49153  >  2400 [ACK] Seq=114109 Ack=1 Win=131072 Len=536 TSval=3889 TSecr=3819"
"346","1.888371","192.138.2.3","192.138.1.3","TCP","590","49153  >  2400 [ACK] Seq=114645 Ack=1 Win=131072 Len=536 TSval=3889 TSecr=3819"
"347","1.888609","192.138.2.3","192.138.1.3","TCP","590","49153  >  2400 [ACK] Seq=115181 Ack=1 Win=131072 Len=536 TSval=3889 TSecr=3819"
"348","1.888818","192.138.2.3","192.138.1.3","TCP","590","49153  >  2400 [ACK] Seq=115717 Ack=1 Win=131072 Len=536 TSval=3889 TSecr=3819"
"349","1.889006","192.138.2.3","192.138.1.3","TCP","590","49153  >  2400 [ACK] Seq=116253 Ack=1 Win=131072 Len=536 TSval=3889 TSecr=3819"
"350","1.889071","192.138.2.3","192.138.1.3","TCP","266","49153  >  2400 [ACK] Seq=116789 Ack=1 Win=131072 Len=212 TSval=3889 TSecr=3819"
"355","1.959589","192.138.2.3","192.138.1.3","TCP","590","49153  >  2400 [ACK] Seq=117001 Ack=1 Win=131072 Len=536 TSval=3961 TSecr=3891"
"356","1.959773","192.138.2.3","192.138.1.3","TCP","590","49153  >  2400 [ACK] Seq=117537 Ack=1 Win=131072 Len=536 TSval=3961 TSecr=3891"
"357","1.959961","192.138.2.3","192.138.1.3","TCP","590","49153  >  2400 [ACK] Seq=118073 Ack=1 Win=131072 Len=536 TSval=3961 TSecr=3891"
"358","1.960185","192.138.2.3","192.138.1.3","TCP","590","49153  >  2400 [ACK] Seq=118609 Ack=1 Win=131072 Len=536 TSval=3961 TSecr=3891"
"359","1.960367","192.138.2.3","192.138.1.3","TCP","590","49153  >  2400 [ACK] Seq=119145 Ack=1 Win=131072 Len=536 TSval=3961 TSecr=3891"
"360","1.960549","192.138.2.3","192.138.1.3","TCP","590","49153  >  2400 [ACK] Seq=119681 Ack=1 Win=131072 Len=536 TSval=3961 TSecr=3891"
"361","1.960746","192.138.2.3","192.138.1.3","TCP","590","49153  >  2400 [ACK] Seq=120217 Ack=1 Win=131072 Len=536 TSval=3961 TSecr=3891"
"362","1.960938","192.138.2.3","192.138.1.3","TCP","590","49153  >  2400 [ACK] Seq=120753 Ack=1 Win=131072 Len=536 TSval=3961 TSecr=3891"
"363","1.961004","192.138.2.3","192.138.1.3","TCP","266","49153  >  2400 [ACK] Seq=121289 Ack=1 Win=131072 Len=212 TSval=3961 TSecr=3891"
"369","2.031591","192.138.2.3","192.138.1.3","TCP","590","49153  >  2400 [ACK] Seq=121501 Ack=1 Win=131072 Len=536 TSval=4033 TSecr=3963"
"370","2.031774","192.138.2.3","192.138.1.3","TCP","590","49153  >  2400 [ACK] Seq=122037 Ack=1 Win=131072 Len=536 TSval=4033 TSecr=3963"
"371","2.031975","192.138.2.3","192.138.1.3","TCP","590","49153  >  2400 [ACK] Seq=122573 Ack=1 Win=131072 Len=536 TSval=4033 TSecr=3963"
"373","2.032189","192.138.2.3","192.138.1.3","TCP","590","49153  >  2400 [ACK] Seq=123109 Ack=1 Win=131072 Len=536 TSval=4033 TSecr=3963"
"374","2.032371","192.138.2.3","192.138.1.3","TCP","590","49153  >  2400 [ACK] Seq=123645 Ack=1 Win=131072 Len=536 TSval=4033 TSecr=3963"
"375","2.032560","192.138.2.3","192.138.1.3","TCP","590","49153  >  2400 [ACK] Seq=124181 Ack=1 Win=131072 Len=536 TSval=4033 TSecr=3963"
"377","2.032747","192.138.2.3","192.138.1.3","TCP","590","49153  >  2400 [ACK] Seq=124717 Ack=1 Win=131072 Len=536 TSval=4033 TSecr=3963"
"378","2.032932","192.138.2.3","192.138.1.3","TCP","590","49153  >  2400 [ACK] Seq=125253 Ack=1 Win=131072 Len=536 TSval=4033 TSecr=3963"
"379","2.033001","192.138.2.3","192.138.1.3","TCP","266","49153  >  2400 [ACK] Seq=125789 Ack=1 Win=131072 Len=212 TSval=4033 TSecr=3963"
"382","2.103591","192.138.2.3","192.138.1.3","TCP","590","49153  >  2400 [ACK] Seq=126001 Ack=1 Win=131072 Len=536 TSval=4105 TSecr=4035"
"383","2.103773","192.138.2.3","192.138.1.3","TCP","590","49153  >  2400 [ACK] Seq=126537 Ack=1 Win=131072 Len=536 TSval=4105 TSecr=4035"
"385","2.103959","192.138.2.3","192.138.1.3","TCP","590","49153  >  2400 [ACK] Seq=127073 Ack=1 Win=131072 Len=536 TSval=4105 TSecr=4035"
"386","2.104145","192.138.2.3","192.138.1.3","TCP","590","49153  >  2400 [ACK] Seq=127609 Ack=1 Win=131072 Len=536 TSval=4105 TSecr=4035"
"387","2.104339","192.138.2.3","192.138.1.3","TCP","590","49153  >  2400 [ACK] Seq=128145 Ack=1 Win=131072 Len=536 TSval=4105 TSecr=4035"
"389","2.104544","192.138.2.3","192.138.1.3","TCP","590","49153  >  2400 [ACK] Seq=128681 Ack=1 Win=131072 Len=536 TSval=4105 TSecr=4035"
"390","2.104733","192.138.2.3","192.138.1.3","TCP","590","49153  >  2400 [ACK] Seq=129217 Ack=1 Win=131072 Len=536 TSval=4105 TSecr=4035"
"392","2.104939","192.138.2.3","192.138.1.3","TCP","590","49153  >  2400 [ACK] Seq=129753 Ack=1 Win=131072 Len=536 TSval=4105 TSecr=4035"
"393","2.105006","192.138.2.3","192.138.1.3","TCP","266","49153  >  2400 [ACK] Seq=130289 Ack=1 Win=131072 Len=212 TSval=4105 TSecr=4035"
"396","2.175591","192.138.2.3","192.138.1.3","TCP","590","49153  >  2400 [ACK] Seq=130501 Ack=1 Win=131072 Len=536 TSval=4177 TSecr=4107"
"397","2.175793","192.138.2.3","192.138.1.3","TCP","590","49153  >  2400 [ACK] Seq=131037 Ack=1 Win=131072 Len=536 TSval=4177 TSecr=4107"
"398","2.175975","192.138.2.3","192.138.1.3","TCP","590","49153  >  2400 [ACK] Seq=131573 Ack=1 Win=131072 Len=536 TSval=4177 TSecr=4107"
"400","2.176196","192.138.2.3","192.138.1.3","TCP","590","49153  >  2400 [ACK] Seq=132109 Ack=1 Win=131072 Len=536 TSval=4177 TSecr=4107"
"401","2.176423","192.138.2.3","192.138.1.3","TCP","590","49153  >  2400 [ACK] Seq=132645 Ack=1 Win=131072 Len=536 TSval=4177 TSecr=4107"
"402","2.176631","192.138.2.3","192.138.1.3","TCP","590","49153  >  2400 [ACK] Seq=133181 Ack=1 Win=131072 Len=536 TSval=4177 TSecr=4107"
"403","2.176814","192.138.2.3","192.138.1.3","TCP","590","49153  >  2400 [ACK] Seq=133717 Ack=1 Win=131072 Len=536 TSval=4177 TSecr=4107"
"404","2.177009","192.138.2.3","192.138.1.3","TCP","590","49153  >  2400 [ACK] Seq=134253 Ack=1 Win=131072 Len=536 TSval=4177 TSecr=4107"
"405","2.177076","192.138.2.3","192.138.1.3","TCP","266","49153  >  2400 [ACK] Seq=134789 Ack=1 Win=131072 Len=212 TSval=4177 TSecr=4107"
"409","2.247591","192.138.2.3","192.138.1.3","TCP","590","49153  >  2400 [ACK] Seq=135001 Ack=1 Win=131072 Len=536 TSval=4249 TSecr=4179"
"410","2.247773","192.138.2.3","192.138.1.3","TCP","590","49153  >  2400 [ACK] Seq=135537 Ack=1 Win=131072 Len=536 TSval=4249 TSecr=4179"
"412","2.247978","192.138.2.3","192.138.1.3","TCP","590","49153  >  2400 [ACK] Seq=136073 Ack=1 Win=131072 Len=536 TSval=4249 TSecr=4179"
"413","2.248209","192.138.2.3","192.138.1.3","TCP","590","49153  >  2400 [ACK] Seq=136609 Ack=1 Win=131072 Len=536 TSval=4249 TSecr=4179"
"414","2.248403","192.138.2.3","192.138.1.3","TCP","590","49153  >  2400 [ACK] Seq=137145 Ack=1 Win=131072 Len=536 TSval=4249 TSecr=4179"
"416","2.248628","192.138.2.3","192.138.1.3","TCP","590","49153  >  2400 [ACK] Seq=137681 Ack=1 Win=131072 Len=536 TSval=4249 TSecr=4179"
"417","2.248815","192.138.2.3","192.138.1.3","TCP","590","49153  >  2400 [ACK] Seq=138217 Ack=1 Win=131072 Len=536 TSval=4249 TSecr=4179"
"419","2.249052","192.138.2.3","192.138.1.3","TCP","590","49153  >  2400 [ACK] Seq=138753 Ack=1 Win=131072 Len=536 TSval=4249 TSecr=4179"
"420","2.249115","192.138.2.3","192.138.1.3","TCP","266","49153  >  2400 [ACK] Seq=139289 Ack=1 Win=131072 Len=212 TSval=4249 TSecr=4179"
"423","2.319591","192.138.2.3","192.138.1.3","TCP","590","49153  >  2400 [ACK] Seq=139501 Ack=1 Win=131072 Len=536 TSval=4321 TSecr=4251"
"424","2.319820","192.138.2.3","192.138.1.3","TCP","590","49153  >  2400 [ACK] Seq=140037 Ack=1 Win=131072 Len=536 TSval=4321 TSecr=4251"
"425","2.320003","192.138.2.3","192.138.1.3","TCP","590","49153  >  2400 [ACK] Seq=140573 Ack=1 Win=131072 Len=536 TSval=4321 TSecr=4251"
"427","2.320203","192.138.2.3","192.138.1.3","TCP","590","49153  >  2400 [ACK] Seq=141109 Ack=1 Win=131072 Len=536 TSval=4321 TSecr=4251"
"428","2.320428","192.138.2.3","192.138.1.3","TCP","590","49153  >  2400 [ACK] Seq=141645 Ack=1 Win=131072 Len=536 TSval=4321 TSecr=4251"
"429","2.320609","192.138.2.3","192.138.1.3","TCP","590","49153  >  2400 [ACK] Seq=142181 Ack=1 Win=131072 Len=536 TSval=4321 TSecr=4251"
"431","2.320795","192.138.2.3","192.138.1.3","TCP","590","49153  >  2400 [ACK] Seq=142717 Ack=1 Win=131072 Len=536 TSval=4321 TSecr=4251"
"432","2.320978","192.138.2.3","192.138.1.3","TCP","590","49153  >  2400 [ACK] Seq=143253 Ack=1 Win=131072 Len=536 TSval=4321 TSecr=4251"
"433","2.321046","192.138.2.3","192.138.1.3","TCP","266","49153  >  2400 [ACK] Seq=143789 Ack=1 Win=131072 Len=212 TSval=4321 TSecr=4251"
"436","2.391591","192.138.2.3","192.138.1.3","TCP","590","49153  >  2400 [ACK] Seq=144001 Ack=1 Win=131072 Len=536 TSval=4393 TSecr=4323"
