"No.","Time","Source","Destination","Protocol","Length","Info"
"1","0.000000","10.0.3.1","192.138.1.3","TCP","58","49153  >  2600 [SYN] Seq=0 Win=65535 Len=0 TSval=3000 TSecr=0 WS=4 SACK_PERM=1"
"4","0.010215","192.138.1.3","10.0.3.1","TCP","58","2600  >  49153 [SYN, ACK] Seq=0 Ack=1 Win=65535 Len=0 TSval=3004 TSecr=3000 WS=4 SACK_PERM=1"
"5","0.010278","10.0.3.1","192.138.1.3","TCP","54","49153  >  2600 [ACK] Seq=1 Ack=1 Win=131072 Len=0 TSval=3010 TSecr=3004"
"6","0.010858","192.138.1.3","192.138.2.3","IPv4","1502","Fragmented IP protocol (proto=UDP 17, off=0, ID=0000) [Reassembled in #7]"
"7","0.011192","192.138.1.3","192.138.2.3","UDP","1110","63  >  49153 Len=2560"
"8","0.058439","10.0.3.1","192.138.1.3","ZEBRA","590","Zebra Request"
"9","0.058498","10.0.3.1","192.138.1.3","ZEBRA","590","Zebra Request"
"10","0.058557","10.0.3.1","192.138.1.3","ZEBRA","590","Zebra Request"
"11","0.058616","10.0.3.1","192.138.1.3","ZEBRA","590","Zebra Request"
"12","0.058675","10.0.3.1","192.138.1.3","ZEBRA","590","Zebra Request"
"13","0.058713","10.0.3.1","192.138.1.3","ZEBRA","374","Zebra Request"
"14","0.058751","192.138.1.3","10.0.3.1","TCP","54","2600  >  49153 [ACK] Seq=1 Ack=537 Win=131072 Len=0 TSval=3058 TSecr=3058"
"15","0.059238","192.138.1.3","10.0.3.1","TCP","54","2600  >  49153 [ACK] Seq=1 Ack=1609 Win=131072 Len=0 TSval=3059 TSecr=3058"
"16","0.059905","192.138.1.3","10.0.3.1","TCP","54","2600  >  49153 [ACK] Seq=1 Ack=2681 Win=131072 Len=0 TSval=3059 TSecr=3058"
"17","0.106439","10.0.3.1","192.138.1.3","ZEBRA","590","Zebra Request"
"18","0.106498","10.0.3.1","192.138.1.3","ZEBRA","590","Zebra Request"
"19","0.106557","10.0.3.1","192.138.1.3","ZEBRA","590","Zebra Request"
"20","0.106616","10.0.3.1","192.138.1.3","ZEBRA","590","Zebra Request"
"21","0.106675","10.0.3.1","192.138.1.3","ZEBRA","590","Zebra Request"
"22","0.106713","10.0.3.1","192.138.1.3","ZEBRA","374","Zebra Request"
"23","0.106751","192.138.1.3","10.0.3.1","TCP","54","2600  >  49153 [ACK] Seq=1 Ack=3537 Win=131072 Len=0 TSval=3106 TSecr=3058"
"24","0.107211","192.138.1.3","10.0.3.1","TCP","54","2600  >  49153 [ACK] Seq=1 Ack=4609 Win=131072 Len=0 TSval=3107 TSecr=3106"
"25","0.107853","192.138.1.3","10.0.3.1","TCP","54","2600  >  49153 [ACK] Seq=1 Ack=5681 Win=131072 Len=0 TSval=3107 TSecr=3106"
"26","0.154439","10.0.3.1","192.138.1.3","ZEBRA","590","Zebra Request"
"27","0.154498","10.0.3.1","192.138.1.3","ZEBRA","590","Zebra Request"
"28","0.154557","10.0.3.1","192.138.1.3","ZEBRA","590","Zebra Request"
"29","0.154616","10.0.3.1","192.138.1.3","ZEBRA","590","Zebra Request"
"30","0.154675","10.0.3.1","192.138.1.3","ZEBRA","590","Zebra Request"
"31","0.154713","10.0.3.1","192.138.1.3","ZEBRA","374","Zebra Request"
"32","0.156445","192.138.1.3","10.0.3.1","TCP","54","2600  >  49153 [ACK] Seq=1 Ack=6537 Win=131072 Len=0 TSval=3154 TSecr=3106"
"33","0.156480","192.138.1.3","10.0.3.1","TCP","54","2600  >  49153 [ACK] Seq=1 Ack=7609 Win=131072 Len=0 TSval=3155 TSecr=3154"
"34","0.156521","192.138.1.3","10.0.3.1","TCP","54","2600  >  49153 [ACK] Seq=1 Ack=8681 Win=131072 Len=0 TSval=3155 TSecr=3154"
"35","0.202439","10.0.3.1","192.138.1.3","ZEBRA","590","Zebra Request"
"36","0.202498","10.0.3.1","192.138.1.3","ZEBRA","590","Zebra Request"
"37","0.202557","10.0.3.1","192.138.1.3","ZEBRA","590","Zebra Request"
"38","0.202616","10.0.3.1","192.138.1.3","ZEBRA","590","Zebra Request"
"39","0.202675","10.0.3.1","192.138.1.3","ZEBRA","590","Zebra Request"
"40","0.202713","10.0.3.1","192.138.1.3","ZEBRA","374","Zebra Request"
"41","0.202751","192.138.1.3","10.0.3.1","TCP","54","2600  >  49153 [ACK] Seq=1 Ack=9537 Win=131072 Len=0 TSval=3202 TSecr=3154"
"42","0.203220","192.138.1.3","10.0.3.1","TCP","54","2600  >  49153 [ACK] Seq=1 Ack=10609 Win=131072 Len=0 TSval=3203 TSecr=3202"
"43","0.203675","192.138.1.3","10.0.3.1","TCP","54","2600  >  49153 [ACK] Seq=1 Ack=11681 Win=131072 Len=0 TSval=3203 TSecr=3202"
"44","0.250439","10.0.3.1","192.138.1.3","ZEBRA","590","Zebra Request"
"45","0.250498","10.0.3.1","192.138.1.3","ZEBRA","590","Zebra Request"
"46","0.250557","10.0.3.1","192.138.1.3","ZEBRA","590","Zebra Request"
"47","0.250616","10.0.3.1","192.138.1.3","ZEBRA","590","Zebra Request"
"48","0.250675","10.0.3.1","192.138.1.3","ZEBRA","590","Zebra Request"
"49","0.250713","10.0.3.1","192.138.1.3","ZEBRA","374","Zebra Request"
"50","0.250751","192.138.1.3","10.0.3.1","TCP","54","2600  >  49153 [ACK] Seq=1 Ack=12537 Win=131072 Len=0 TSval=3250 TSecr=3202"
"51","0.251213","192.138.1.3","10.0.3.1","TCP","54","2600  >  49153 [ACK] Seq=1 Ack=13609 Win=131072 Len=0 TSval=3251 TSecr=3250"
"52","0.251873","192.138.1.3","10.0.3.1","TCP","54","2600  >  49153 [ACK] Seq=1 Ack=14681 Win=131072 Len=0 TSval=3251 TSecr=3250"
"53","0.298439","10.0.3.1","192.138.1.3","ZEBRA","590","Zebra Request"
"54","0.298498","10.0.3.1","192.138.1.3","ZEBRA","590","Zebra Request"
"55","0.298557","10.0.3.1","192.138.1.3","ZEBRA","590","Zebra Request"
"56","0.298616","10.0.3.1","192.138.1.3","ZEBRA","590","Zebra Request"
"57","0.298675","10.0.3.1","192.138.1.3","ZEBRA","590","Zebra Request"
"58","0.298713","10.0.3.1","192.138.1.3","ZEBRA","374","Zebra Request"
"59","0.298751","192.138.1.3","10.0.3.1","TCP","54","2600  >  49153 [ACK] Seq=1 Ack=15537 Win=131072 Len=0 TSval=3298 TSecr=3250"
"60","0.299211","192.138.1.3","10.0.3.1","TCP","54","2600  >  49153 [ACK] Seq=1 Ack=16609 Win=131072 Len=0 TSval=3299 TSecr=3298"
"61","0.299844","192.138.1.3","10.0.3.1","TCP","54","2600  >  49153 [ACK] Seq=1 Ack=17681 Win=131072 Len=0 TSval=3299 TSecr=3298"
"62","0.346439","10.0.3.1","192.138.1.3","ZEBRA","590","Zebra Request"
"63","0.346498","10.0.3.1","192.138.1.3","ZEBRA","590","Zebra Request"
"64","0.346557","10.0.3.1","192.138.1.3","ZEBRA","590","Zebra Request"
"65","0.346616","10.0.3.1","192.138.1.3","ZEBRA","590","Zebra Request"
"66","0.346675","10.0.3.1","192.138.1.3","ZEBRA","590","Zebra Request"
"67","0.346713","10.0.3.1","192.138.1.3","ZEBRA","374","Zebra Request"
"68","0.346751","192.138.1.3","10.0.3.1","TCP","54","2600  >  49153 [ACK] Seq=1 Ack=18537 Win=131072 Len=0 TSval=3346 TSecr=3298"
"69","0.347228","192.138.1.3","10.0.3.1","TCP","54","2600  >  49153 [ACK] Seq=1 Ack=19609 Win=131072 Len=0 TSval=3347 TSecr=3346"
"70","0.347676","192.138.1.3","10.0.3.1","TCP","54","2600  >  49153 [ACK] Seq=1 Ack=20681 Win=131072 Len=0 TSval=3347 TSecr=3346"
"71","0.394439","10.0.3.1","192.138.1.3","ZEBRA","590","Zebra Request"
"72","0.394498","10.0.3.1","192.138.1.3","ZEBRA","590","Zebra Request"
"73","0.394557","10.0.3.1","192.138.1.3","ZEBRA","590","Zebra Request"
"74","0.394616","10.0.3.1","192.138.1.3","ZEBRA","590","Zebra Request"
"75","0.394675","10.0.3.1","192.138.1.3","ZEBRA","590","Zebra Request"
"76","0.394713","10.0.3.1","192.138.1.3","ZEBRA","374","Zebra Request"
"77","0.396334","192.138.1.3","10.0.3.1","TCP","54","2600  >  49153 [ACK] Seq=1 Ack=21537 Win=131072 Len=0 TSval=3394 TSecr=3346"
"78","0.396370","192.138.1.3","10.0.3.1","TCP","54","2600  >  49153 [ACK] Seq=1 Ack=22609 Win=131072 Len=0 TSval=3395 TSecr=3394"
"79","0.396404","192.138.1.3","10.0.3.1","TCP","54","2600  >  49153 [ACK] Seq=1 Ack=23681 Win=131072 Len=0 TSval=3395 TSecr=3394"
"80","0.442439","10.0.3.1","192.138.1.3","ZEBRA","590","Zebra Request"
"81","0.442498","10.0.3.1","192.138.1.3","ZEBRA","590","Zebra Request"
"82","0.442557","10.0.3.1","192.138.1.3","ZEBRA","590","Zebra Request"
"83","0.442616","10.0.3.1","192.138.1.3","ZEBRA","590","Zebra Request"
"84","0.442675","10.0.3.1","192.138.1.3","ZEBRA","590","Zebra Request"
"85","0.442713","10.0.3.1","192.138.1.3","ZEBRA","374","Zebra Request"
"86","0.442751","192.138.1.3","10.0.3.1","TCP","54","2600  >  49153 [ACK] Seq=1 Ack=24537 Win=131072 Len=0 TSval=3442 TSecr=3394"
"87","0.443230","192.138.1.3","10.0.3.1","TCP","54","2600  >  49153 [ACK] Seq=1 Ack=25609 Win=131072 Len=0 TSval=3443 TSecr=3442"
"88","0.443715","192.138.1.3","10.0.3.1","TCP","54","2600  >  49153 [ACK] Seq=1 Ack=26681 Win=131072 Len=0 TSval=3443 TSecr=3442"
"89","0.490439","10.0.3.1","192.138.1.3","ZEBRA","590","Zebra Request"
"90","0.490498","10.0.3.1","192.138.1.3","ZEBRA","590","Zebra Request"
"91","0.490557","10.0.3.1","192.138.1.3","ZEBRA","590","Zebra Request"
"92","0.490616","10.0.3.1","192.138.1.3","ZEBRA","590","Zebra Request"
"93","0.490675","10.0.3.1","192.138.1.3","ZEBRA","590","Zebra Request"
"94","0.490713","10.0.3.1","192.138.1.3","ZEBRA","374","Zebra Request"
"95","0.490751","192.138.1.3","10.0.3.1","TCP","54","2600  >  49153 [ACK] Seq=1 Ack=27537 Win=131072 Len=0 TSval=3490 TSecr=3442"
"96","0.492187","192.138.1.3","10.0.3.1","TCP","54","2600  >  49153 [ACK] Seq=1 Ack=28609 Win=131072 Len=0 TSval=3491 TSecr=3490"
"97","0.492221","192.138.1.3","10.0.3.1","TCP","54","2600  >  49153 [ACK] Seq=1 Ack=29681 Win=131072 Len=0 TSval=3491 TSecr=3490"
"98","0.538439","10.0.3.1","192.138.1.3","ZEBRA","590","Zebra Request"
"99","0.538498","10.0.3.1","192.138.1.3","ZEBRA","590","Zebra Request"
"100","0.538557","10.0.3.1","192.138.1.3","ZEBRA","590","Zebra Request"
"101","0.538616","10.0.3.1","192.138.1.3","ZEBRA","590","Zebra Request"
"102","0.538675","10.0.3.1","192.138.1.3","ZEBRA","590","Zebra Request"
"103","0.538713","10.0.3.1","192.138.1.3","ZEBRA","374","Zebra Request"
"104","0.538751","192.138.1.3","10.0.3.1","TCP","54","2600  >  49153 [ACK] Seq=1 Ack=30537 Win=131072 Len=0 TSval=3538 TSecr=3490"
"105","0.539200","192.138.1.3","10.0.3.1","TCP","54","2600  >  49153 [ACK] Seq=1 Ack=31609 Win=131072 Len=0 TSval=3539 TSecr=3538"
"106","0.539692","192.138.1.3","10.0.3.1","TCP","54","2600  >  49153 [ACK] Seq=1 Ack=32681 Win=131072 Len=0 TSval=3539 TSecr=3538"
"107","0.586439","10.0.3.1","192.138.1.3","ZEBRA","590","Zebra Request"
"108","0.586498","10.0.3.1","192.138.1.3","ZEBRA","590","Zebra Request"
"109","0.586557","10.0.3.1","192.138.1.3","ZEBRA","590","Zebra Request"
"110","0.586616","10.0.3.1","192.138.1.3","ZEBRA","590","Zebra Request"
"111","0.586675","10.0.3.1","192.138.1.3","ZEBRA","590","Zebra Request"
"112","0.586713","10.0.3.1","192.138.1.3","ZEBRA","374","Zebra Request"
"113","0.586751","192.138.1.3","10.0.3.1","TCP","54","2600  >  49153 [ACK] Seq=1 Ack=33537 Win=131072 Len=0 TSval=3586 TSecr=3538"
"114","0.587199","192.138.1.3","10.0.3.1","TCP","54","2600  >  49153 [ACK] Seq=1 Ack=34609 Win=131072 Len=0 TSval=3587 TSecr=3586"
"115","0.588280","192.138.1.3","10.0.3.1","TCP","54","2600  >  49153 [ACK] Seq=1 Ack=35681 Win=131072 Len=0 TSval=3587 TSecr=3586"
"116","0.634439","10.0.3.1","192.138.1.3","ZEBRA","590","Zebra Request"
"117","0.634498","10.0.3.1","192.138.1.3","ZEBRA","590","Zebra Request"
"118","0.634557","10.0.3.1","192.138.1.3","ZEBRA","590","Zebra Request"
"119","0.634616","10.0.3.1","192.138.1.3","ZEBRA","590","Zebra Request"
"120","0.634675","10.0.3.1","192.138.1.3","ZEBRA","590","Zebra Request"
"121","0.634713","10.0.3.1","192.138.1.3","ZEBRA","374","Zebra Request"
"122","0.634751","192.138.1.3","10.0.3.1","TCP","54","2600  >  49153 [ACK] Seq=1 Ack=36537 Win=131072 Len=0 TSval=3634 TSecr=3586"
"123","0.635194","192.138.1.3","10.0.3.1","TCP","54","2600  >  49153 [ACK] Seq=1 Ack=37609 Win=131072 Len=0 TSval=3635 TSecr=3634"
"124","0.635709","192.138.1.3","10.0.3.1","TCP","54","2600  >  49153 [ACK] Seq=1 Ack=38681 Win=131072 Len=0 TSval=3635 TSecr=3634"
"125","0.682439","10.0.3.1","192.138.1.3","ZEBRA","590","Zebra Request"
"126","0.682498","10.0.3.1","192.138.1.3","ZEBRA","590","Zebra Request"
"127","0.682557","10.0.3.1","192.138.1.3","ZEBRA","590","Zebra Request"
"128","0.682616","10.0.3.1","192.138.1.3","ZEBRA","590","Zebra Request"
"129","0.682675","10.0.3.1","192.138.1.3","ZEBRA","590","Zebra Request"
"130","0.682713","10.0.3.1","192.138.1.3","ZEBRA","374","Zebra Request"
"131","0.682751","192.138.1.3","10.0.3.1","TCP","54","2600  >  49153 [ACK] Seq=1 Ack=39537 Win=131072 Len=0 TSval=3682 TSecr=3634"
"132","0.683205","192.138.1.3","10.0.3.1","TCP","54","2600  >  49153 [ACK] Seq=1 Ack=40609 Win=131072 Len=0 TSval=3683 TSecr=3682"
"133","0.683657","192.138.1.3","10.0.3.1","TCP","54","2600  >  49153 [ACK] Seq=1 Ack=41681 Win=131072 Len=0 TSval=3683 TSecr=3682"
"134","0.730439","10.0.3.1","192.138.1.3","ZEBRA","590","Zebra Request"
"135","0.730498","10.0.3.1","192.138.1.3","ZEBRA","590","Zebra Request"
"136","0.730557","10.0.3.1","192.138.1.3","ZEBRA","590","Zebra Request"
"137","0.730616","10.0.3.1","192.138.1.3","ZEBRA","590","Zebra Request"
"138","0.730675","10.0.3.1","192.138.1.3","ZEBRA","590","Zebra Request"
"139","0.730713","10.0.3.1","192.138.1.3","ZEBRA","374","Zebra Request"
"140","0.730751","192.138.1.3","10.0.3.1","TCP","54","2600  >  49153 [ACK] Seq=1 Ack=42537 Win=131072 Len=0 TSval=3730 TSecr=3682"
"141","0.731194","192.138.1.3","10.0.3.1","TCP","54","2600  >  49153 [ACK] Seq=1 Ack=43609 Win=131072 Len=0 TSval=3731 TSecr=3730"
"142","0.731718","192.138.1.3","10.0.3.1","TCP","54","2600  >  49153 [ACK] Seq=1 Ack=44681 Win=131072 Len=0 TSval=3731 TSecr=3730"
"143","0.778439","10.0.3.1","192.138.1.3","ZEBRA","590","Zebra Request"
"144","0.778498","10.0.3.1","192.138.1.3","ZEBRA","590","Zebra Request"
"145","0.778557","10.0.3.1","192.138.1.3","ZEBRA","590","Zebra Request"
"146","0.778616","10.0.3.1","192.138.1.3","ZEBRA","590","Zebra Request"
"147","0.778675","10.0.3.1","192.138.1.3","ZEBRA","590","Zebra Request"
"148","0.778713","10.0.3.1","192.138.1.3","ZEBRA","374","Zebra Request"
"149","0.778751","192.138.1.3","10.0.3.1","TCP","54","2600  >  49153 [ACK] Seq=1 Ack=45537 Win=131072 Len=0 TSval=3778 TSecr=3730"
"150","0.779196","192.138.1.3","10.0.3.1","TCP","54","2600  >  49153 [ACK] Seq=1 Ack=46609 Win=131072 Len=0 TSval=3779 TSecr=3778"
"151","0.779920","192.138.1.3","10.0.3.1","TCP","54","2600  >  49153 [ACK] Seq=1 Ack=47681 Win=131072 Len=0 TSval=3779 TSecr=3778"
"152","0.826439","10.0.3.1","192.138.1.3","ZEBRA","590","Zebra Request"
"153","0.826498","10.0.3.1","192.138.1.3","ZEBRA","590","Zebra Request"
"154","0.826557","10.0.3.1","192.138.1.3","ZEBRA","590","Zebra Request"
"155","0.826616","10.0.3.1","192.138.1.3","ZEBRA","590","Zebra Request"
"156","0.826675","10.0.3.1","192.138.1.3","ZEBRA","590","Zebra Request"
"157","0.826713","10.0.3.1","192.138.1.3","ZEBRA","374","Zebra Request"
"158","0.827781","192.138.1.3","10.0.3.1","TCP","54","2600  >  49153 [ACK] Seq=1 Ack=48537 Win=131072 Len=0 TSval=3826 TSecr=3778"
"159","0.827821","192.138.1.3","10.0.3.1","TCP","54","2600  >  49153 [ACK] Seq=1 Ack=49609 Win=131072 Len=0 TSval=3827 TSecr=3826"
"160","0.827855","192.138.1.3","10.0.3.1","TCP","54","2600  >  49153 [ACK] Seq=1 Ack=50681 Win=131072 Len=0 TSval=3827 TSecr=3826"
"161","0.874439","10.0.3.1","192.138.1.3","ZEBRA","590","Zebra Request"
"162","0.874498","10.0.3.1","192.138.1.3","ZEBRA","590","Zebra Request"
"163","0.874557","10.0.3.1","192.138.1.3","ZEBRA","590","Zebra Request"
"164","0.874616","10.0.3.1","192.138.1.3","ZEBRA","590","Zebra Request"
"165","0.874675","10.0.3.1","192.138.1.3","ZEBRA","590","Zebra Request"
"166","0.874713","10.0.3.1","192.138.1.3","ZEBRA","374","Zebra Request"
"167","0.874751","192.138.1.3","10.0.3.1","TCP","54","2600  >  49153 [ACK] Seq=1 Ack=51537 Win=131072 Len=0 TSval=3874 TSecr=3826"
"168","0.875217","192.138.1.3","10.0.3.1","TCP","54","2600  >  49153 [ACK] Seq=1 Ack=52609 Win=131072 Len=0 TSval=3875 TSecr=3874"
"169","0.875662","192.138.1.3","10.0.3.1","TCP","54","2600  >  49153 [ACK] Seq=1 Ack=53681 Win=131072 Len=0 TSval=3875 TSecr=3874"
"170","0.922439","10.0.3.1","192.138.1.3","ZEBRA","590","Zebra Request"
"171","0.922498","10.0.3.1","192.138.1.3","ZEBRA","590","Zebra Request"
"172","0.922557","10.0.3.1","192.138.1.3","ZEBRA","590","Zebra Request"
"173","0.922616","10.0.3.1","192.138.1.3","ZEBRA","590","Zebra Request"
"174","0.922675","10.0.3.1","192.138.1.3","ZEBRA","590","Zebra Request"
"175","0.922713","10.0.3.1","192.138.1.3","ZEBRA","374","Zebra Request"
"176","0.923886","192.138.1.3","10.0.3.1","TCP","54","2600  >  49153 [ACK] Seq=1 Ack=54537 Win=131072 Len=0 TSval=3922 TSecr=3874"
"177","0.923924","192.138.1.3","10.0.3.1","TCP","54","2600  >  49153 [ACK] Seq=1 Ack=55609 Win=131072 Len=0 TSval=3923 TSecr=3922"
"178","0.923957","192.138.1.3","10.0.3.1","TCP","54","2600  >  49153 [ACK] Seq=1 Ack=56681 Win=131072 Len=0 TSval=3923 TSecr=3922"
"179","0.970439","10.0.3.1","192.138.1.3","ZEBRA","590","Zebra Request"
"180","0.970498","10.0.3.1","192.138.1.3","ZEBRA","590","Zebra Request"
"181","0.970557","10.0.3.1","192.138.1.3","ZEBRA","590","Zebra Request"
"182","0.970616","10.0.3.1","192.138.1.3","ZEBRA","590","Zebra Request"
"183","0.970675","10.0.3.1","192.138.1.3","ZEBRA","590","Zebra Request"
"184","0.970713","10.0.3.1","192.138.1.3","ZEBRA","374","Zebra Request"
"185","0.970751","192.138.1.3","10.0.3.1","TCP","54","2600  >  49153 [ACK] Seq=1 Ack=57537 Win=131072 Len=0 TSval=3970 TSecr=3922"
"186","0.972354","192.138.1.3","10.0.3.1","TCP","54","2600  >  49153 [ACK] Seq=1 Ack=58609 Win=131072 Len=0 TSval=3971 TSecr=3970"
"187","0.972390","192.138.1.3","10.0.3.1","TCP","54","2600  >  49153 [ACK] Seq=1 Ack=59681 Win=131072 Len=0 TSval=3971 TSecr=3970"
"188","1.018441","10.0.3.1","192.138.1.3","ZEBRA","590","Zebra Request"
"189","1.018500","10.0.3.1","192.138.1.3","ZEBRA","590","Zebra Request"
"190","1.018559","10.0.3.1","192.138.1.3","ZEBRA","590","Zebra Request"
"191","1.018618","10.0.3.1","192.138.1.3","ZEBRA","590","Zebra Request"
"192","1.018677","10.0.3.1","192.138.1.3","ZEBRA","590","Zebra Request"
"193","1.018715","10.0.3.1","192.138.1.3","ZEBRA","374","Zebra Request"
"194","1.018753","192.138.1.3","10.0.3.1","TCP","54","2600  >  49153 [ACK] Seq=1 Ack=60537 Win=131072 Len=0 TSval=4018 TSecr=3970"
"195","1.019211","192.138.1.3","10.0.3.1","TCP","54","2600  >  49153 [ACK] Seq=1 Ack=61609 Win=131072 Len=0 TSval=4019 TSecr=4018"
"196","1.019741","192.138.1.3","10.0.3.1","TCP","54","2600  >  49153 [ACK] Seq=1 Ack=62681 Win=131072 Len=0 TSval=4019 TSecr=4018"
"197","1.066441","10.0.3.1","192.138.1.3","ZEBRA","590","Zebra Request"
"198","1.066500","10.0.3.1","192.138.1.3","ZEBRA","590","Zebra Request"
"199","1.066559","10.0.3.1","192.138.1.3","ZEBRA","590","Zebra Request"
"200","1.066618","10.0.3.1","192.138.1.3","ZEBRA","590","Zebra Request"
"201","1.066677","10.0.3.1","192.138.1.3","ZEBRA","590","Zebra Request"
"202","1.066715","10.0.3.1","192.138.1.3","ZEBRA","374","Zebra Request"
"203","1.066753","192.138.1.3","10.0.3.1","TCP","54","2600  >  49153 [ACK] Seq=1 Ack=63537 Win=131072 Len=0 TSval=4066 TSecr=4018"
"204","1.067223","192.138.1.3","10.0.3.1","TCP","54","2600  >  49153 [ACK] Seq=1 Ack=64609 Win=131072 Len=0 TSval=4067 TSecr=4066"
"205","1.067685","192.138.1.3","10.0.3.1","TCP","54","2600  >  49153 [ACK] Seq=1 Ack=65681 Win=131072 Len=0 TSval=4067 TSecr=4066"
"206","1.114441","10.0.3.1","192.138.1.3","ZEBRA","590","Zebra Request"
"207","1.114500","10.0.3.1","192.138.1.3","ZEBRA","590","Zebra Request"
"208","1.114559","10.0.3.1","192.138.1.3","ZEBRA","590","Zebra Request"
"209","1.114618","10.0.3.1","192.138.1.3","ZEBRA","590","Zebra Request"
"210","1.114677","10.0.3.1","192.138.1.3","ZEBRA","590","Zebra Request"
"211","1.114715","10.0.3.1","192.138.1.3","ZEBRA","374","Zebra Request"
"212","1.116587","192.138.1.3","10.0.3.1","TCP","54","2600  >  49153 [ACK] Seq=1 Ack=66537 Win=131072 Len=0 TSval=4114 TSecr=4066"
"213","1.116622","192.138.1.3","10.0.3.1","TCP","54","2600  >  49153 [ACK] Seq=1 Ack=67609 Win=131072 Len=0 TSval=4115 TSecr=4114"
"214","1.116658","192.138.1.3","10.0.3.1","TCP","54","2600  >  49153 [ACK] Seq=1 Ack=68681 Win=131072 Len=0 TSval=4115 TSecr=4114"
"215","1.162441","10.0.3.1","192.138.1.3","ZEBRA","590","Zebra Request"
"216","1.162500","10.0.3.1","192.138.1.3","ZEBRA","590","Zebra Request"
"217","1.162559","10.0.3.1","192.138.1.3","ZEBRA","590","Zebra Request"
"218","1.162618","10.0.3.1","192.138.1.3","ZEBRA","590","Zebra Request"
"219","1.162677","10.0.3.1","192.138.1.3","ZEBRA","590","Zebra Request"
"220","1.162715","10.0.3.1","192.138.1.3","ZEBRA","374","Zebra Request"
"221","1.162753","192.138.1.3","10.0.3.1","TCP","54","2600  >  49153 [ACK] Seq=1 Ack=69537 Win=131072 Len=0 TSval=4162 TSecr=4114"
"222","1.163233","192.138.1.3","10.0.3.1","TCP","54","2600  >  49153 [ACK] Seq=1 Ack=70609 Win=131072 Len=0 TSval=4163 TSecr=4162"
"223","1.163963","192.138.1.3","10.0.3.1","TCP","54","2600  >  49153 [ACK] Seq=1 Ack=71681 Win=131072 Len=0 TSval=4163 TSecr=4162"
"224","1.210441","10.0.3.1","192.138.1.3","ZEBRA","590","Zebra Request"
"225","1.210500","10.0.3.1","192.138.1.3","ZEBRA","590","Zebra Request"
"226","1.210559","10.0.3.1","192.138.1.3","ZEBRA","590","Zebra Request"
"227","1.210618","10.0.3.1","192.138.1.3","ZEBRA","590","Zebra Request"
"228","1.210677","10.0.3.1","192.138.1.3","ZEBRA","590","Zebra Request"
"229","1.210715","10.0.3.1","192.138.1.3","ZEBRA","374","Zebra Request"
"230","1.210753","192.138.1.3","10.0.3.1","TCP","54","2600  >  49153 [ACK] Seq=1 Ack=72537 Win=131072 Len=0 TSval=4210 TSecr=4162"
"231","1.211204","192.138.1.3","10.0.3.1","TCP","54","2600  >  49153 [ACK] Seq=1 Ack=73609 Win=131072 Len=0 TSval=4211 TSecr=4210"
"232","1.211662","192.138.1.3","10.0.3.1","TCP","54","2600  >  49153 [ACK] Seq=1 Ack=74681 Win=131072 Len=0 TSval=4211 TSecr=4210"
"233","1.258441","10.0.3.1","192.138.1.3","ZEBRA","590","Zebra Request"
"234","1.258500","10.0.3.1","192.138.1.3","ZEBRA","590","Zebra Request"
"235","1.258559","10.0.3.1","192.138.1.3","ZEBRA","590","Zebra Request"
"236","1.258618","10.0.3.1","192.138.1.3","ZEBRA","590","Zebra Request"
"237","1.258677","10.0.3.1","192.138.1.3","ZEBRA","590","Zebra Request"
"238","1.258715","10.0.3.1","192.138.1.3","ZEBRA","374","Zebra Request"
"239","1.258753","192.138.1.3","10.0.3.1","TCP","54","2600  >  49153 [ACK] Seq=1 Ack=75537 Win=131072 Len=0 TSval=4258 TSecr=4210"
"240","1.259260","192.138.1.3","10.0.3.1","TCP","54","2600  >  49153 [ACK] Seq=1 Ack=76609 Win=131072 Len=0 TSval=4259 TSecr=4258"
"241","1.259757","192.138.1.3","10.0.3.1","TCP","54","2600  >  49153 [ACK] Seq=1 Ack=77681 Win=131072 Len=0 TSval=4259 TSecr=4258"
"242","1.306441","10.0.3.1","192.138.1.3","ZEBRA","590","Zebra Request"
"243","1.306500","10.0.3.1","192.138.1.3","ZEBRA","590","Zebra Request"
"244","1.306559","10.0.3.1","192.138.1.3","ZEBRA","590","Zebra Request"
"245","1.306618","10.0.3.1","192.138.1.3","ZEBRA","590","Zebra Request"
"246","1.306677","10.0.3.1","192.138.1.3","ZEBRA","590","Zebra Request"
"247","1.306715","10.0.3.1","192.138.1.3","ZEBRA","374","Zebra Request"
"248","1.306753","192.138.1.3","10.0.3.1","TCP","54","2600  >  49153 [ACK] Seq=1 Ack=78537 Win=131072 Len=0 TSval=4306 TSecr=4258"
"249","1.307278","192.138.1.3","10.0.3.1","TCP","54","2600  >  49153 [ACK] Seq=1 Ack=79609 Win=131072 Len=0 TSval=4307 TSecr=4306"
"250","1.307771","192.138.1.3","10.0.3.1","TCP","54","2600  >  49153 [ACK] Seq=1 Ack=80681 Win=131072 Len=0 TSval=4307 TSecr=4306"
"251","1.354441","10.0.3.1","192.138.1.3","ZEBRA","590","Zebra Request"
"252","1.354500","10.0.3.1","192.138.1.3","ZEBRA","590","Zebra Request"
"253","1.354559","10.0.3.1","192.138.1.3","ZEBRA","590","Zebra Request"
"254","1.354618","10.0.3.1","192.138.1.3","ZEBRA","590","Zebra Request"
"255","1.354677","10.0.3.1","192.138.1.3","ZEBRA","590","Zebra Request"
"256","1.354715","10.0.3.1","192.138.1.3","ZEBRA","374","Zebra Request"
"257","1.354753","192.138.1.3","10.0.3.1","TCP","54","2600  >  49153 [ACK] Seq=1 Ack=81537 Win=131072 Len=0 TSval=4354 TSecr=4306"
"258","1.355886","192.138.1.3","10.0.3.1","TCP","54","2600  >  49153 [ACK] Seq=1 Ack=82609 Win=131072 Len=0 TSval=4355 TSecr=4354"
"259","1.355921","192.138.1.3","10.0.3.1","TCP","54","2600  >  49153 [ACK] Seq=1 Ack=83681 Win=131072 Len=0 TSval=4355 TSecr=4354"
"260","1.402441","10.0.3.1","192.138.1.3","ZEBRA","590","Zebra Request"
"261","1.402500","10.0.3.1","192.138.1.3","ZEBRA","590","Zebra Request"
"262","1.402559","10.0.3.1","192.138.1.3","ZEBRA","590","Zebra Request"
"263","1.402618","10.0.3.1","192.138.1.3","ZEBRA","590","Zebra Request"
"264","1.402677","10.0.3.1","192.138.1.3","ZEBRA","590","Zebra Request"
"265","1.402715","10.0.3.1","192.138.1.3","ZEBRA","374","Zebra Request"
"266","1.402753","192.138.1.3","10.0.3.1","TCP","54","2600  >  49153 [ACK] Seq=1 Ack=84537 Win=131072 Len=0 TSval=4402 TSecr=4354"
"267","1.403195","192.138.1.3","10.0.3.1","TCP","54","2600  >  49153 [ACK] Seq=1 Ack=85609 Win=131072 Len=0 TSval=4403 TSecr=4402"
"268","1.403657","192.138.1.3","10.0.3.1","TCP","54","2600  >  49153 [ACK] Seq=1 Ack=86681 Win=131072 Len=0 TSval=4403 TSecr=4402"
"269","1.450441","10.0.3.1","192.138.1.3","ZEBRA","590","Zebra Request"
"270","1.450500","10.0.3.1","192.138.1.3","ZEBRA","590","Zebra Request"
"271","1.450559","10.0.3.1","192.138.1.3","ZEBRA","590","Zebra Request"
"272","1.450618","10.0.3.1","192.138.1.3","ZEBRA","590","Zebra Request"
"273","1.450677","10.0.3.1","192.138.1.3","ZEBRA","590","Zebra Request"
"274","1.450715","10.0.3.1","192.138.1.3","ZEBRA","374","Zebra Request"
"275","1.450753","192.138.1.3","10.0.3.1","TCP","54","2600  >  49153 [ACK] Seq=1 Ack=87537 Win=131072 Len=0 TSval=4450 TSecr=4402"
"276","1.451202","192.138.1.3","10.0.3.1","TCP","54","2600  >  49153 [ACK] Seq=1 Ack=88609 Win=131072 Len=0 TSval=4451 TSecr=4450"
"277","1.451655","192.138.1.3","10.0.3.1","TCP","54","2600  >  49153 [ACK] Seq=1 Ack=89681 Win=131072 Len=0 TSval=4451 TSecr=4450"
"278","1.498441","10.0.3.1","192.138.1.3","ZEBRA","590","Zebra Request"
"279","1.498500","10.0.3.1","192.138.1.3","ZEBRA","590","Zebra Request"
"280","1.498559","10.0.3.1","192.138.1.3","ZEBRA","590","Zebra Request"
"281","1.498618","10.0.3.1","192.138.1.3","ZEBRA","590","Zebra Request"
"282","1.498677","10.0.3.1","192.138.1.3","ZEBRA","590","Zebra Request"
"283","1.498715","10.0.3.1","192.138.1.3","ZEBRA","374","Zebra Request"
"284","1.498753","192.138.1.3","10.0.3.1","TCP","54","2600  >  49153 [ACK] Seq=1 Ack=90537 Win=131072 Len=0 TSval=4498 TSecr=4450"
"285","1.499247","192.138.1.3","10.0.3.1","TCP","54","2600  >  49153 [ACK] Seq=1 Ack=91609 Win=131072 Len=0 TSval=4499 TSecr=4498"
"286","1.499702","192.138.1.3","10.0.3.1","TCP","54","2600  >  49153 [ACK] Seq=1 Ack=92681 Win=131072 Len=0 TSval=4499 TSecr=4498"
"287","1.546441","10.0.3.1","192.138.1.3","ZEBRA","590","Zebra Request"
"288","1.546500","10.0.3.1","192.138.1.3","ZEBRA","590","Zebra Request"
"289","1.546559","10.0.3.1","192.138.1.3","ZEBRA","590","Zebra Request"
"290","1.546618","10.0.3.1","192.138.1.3","ZEBRA","590","Zebra Request"
"291","1.546677","10.0.3.1","192.138.1.3","ZEBRA","590","Zebra Request"
"292","1.546715","10.0.3.1","192.138.1.3","ZEBRA","374","Zebra Request"
"293","1.546753","192.138.1.3","10.0.3.1","TCP","54","2600  >  49153 [ACK] Seq=1 Ack=93537 Win=131072 Len=0 TSval=4546 TSecr=4498"
"294","1.547233","192.138.1.3","10.0.3.1","TCP","54","2600  >  49153 [ACK] Seq=1 Ack=94609 Win=131072 Len=0 TSval=4547 TSecr=4546"
"295","1.548132","192.138.1.3","10.0.3.1","TCP","54","2600  >  49153 [ACK] Seq=1 Ack=95681 Win=131072 Len=0 TSval=4547 TSecr=4546"
"296","1.594441","10.0.3.1","192.138.1.3","ZEBRA","590","Zebra Request"
"297","1.594500","10.0.3.1","192.138.1.3","ZEBRA","590","Zebra Request"
"298","1.594559","10.0.3.1","192.138.1.3","ZEBRA","590","Zebra Request"
"299","1.594618","10.0.3.1","192.138.1.3","ZEBRA","590","Zebra Request"
"300","1.594677","10.0.3.1","192.138.1.3","ZEBRA","590","Zebra Request"
"301","1.594715","10.0.3.1","192.138.1.3","ZEBRA","374","Zebra Request"
"302","1.594753","192.138.1.3","10.0.3.1","TCP","54","2600  >  49153 [ACK] Seq=1 Ack=96537 Win=131072 Len=0 TSval=4594 TSecr=4546"
"303","1.595200","192.138.1.3","10.0.3.1","TCP","54","2600  >  49153 [ACK] Seq=1 Ack=97609 Win=131072 Len=0 TSval=4595 TSecr=4594"
"304","1.595981","192.138.1.3","10.0.3.1","TCP","54","2600  >  49153 [ACK] Seq=1 Ack=98681 Win=131072 Len=0 TSval=4595 TSecr=4594"
"305","1.642441","10.0.3.1","192.138.1.3","ZEBRA","590","Zebra Request"
"306","1.642500","10.0.3.1","192.138.1.3","ZEBRA","590","Zebra Request"
"307","1.642559","10.0.3.1","192.138.1.3","ZEBRA","590","Zebra Request"
"308","1.642618","10.0.3.1","192.138.1.3","ZEBRA","590","Zebra Request"
"309","1.642677","10.0.3.1","192.138.1.3","ZEBRA","590","Zebra Request"
"310","1.642715","10.0.3.1","192.138.1.3","ZEBRA","374","Zebra Request"
"311","1.642753","192.138.1.3","10.0.3.1","TCP","54","2600  >  49153 [ACK] Seq=1 Ack=99537 Win=131072 Len=0 TSval=4642 TSecr=4594"
"312","1.643217","192.138.1.3","10.0.3.1","TCP","54","2600  >  49153 [ACK] Seq=1 Ack=100609 Win=131072 Len=0 TSval=4643 TSecr=4642"
"313","1.643683","192.138.1.3","10.0.3.1","TCP","54","2600  >  49153 [ACK] Seq=1 Ack=101681 Win=131072 Len=0 TSval=4643 TSecr=4642"
"314","1.690441","10.0.3.1","192.138.1.3","ZEBRA","590","Zebra Request"
"315","1.690500","10.0.3.1","192.138.1.3","ZEBRA","590","Zebra Request"
"316","1.690559","10.0.3.1","192.138.1.3","ZEBRA","590","Zebra Request"
"317","1.690618","10.0.3.1","192.138.1.3","ZEBRA","590","Zebra Request"
"318","1.690677","10.0.3.1","192.138.1.3","ZEBRA","590","Zebra Request"
"319","1.690715","10.0.3.1","192.138.1.3","ZEBRA","374","Zebra Request"
"320","1.690753","192.138.1.3","10.0.3.1","TCP","54","2600  >  49153 [ACK] Seq=1 Ack=102537 Win=131072 Len=0 TSval=4690 TSecr=4642"
"321","1.691207","192.138.1.3","10.0.3.1","TCP","54","2600  >  49153 [ACK] Seq=1 Ack=103609 Win=131072 Len=0 TSval=4691 TSecr=4690"
"322","1.691658","192.138.1.3","10.0.3.1","TCP","54","2600  >  49153 [ACK] Seq=1 Ack=104681 Win=131072 Len=0 TSval=4691 TSecr=4690"
"323","1.738441","10.0.3.1","192.138.1.3","ZEBRA","590","Zebra Request"
"324","1.738500","10.0.3.1","192.138.1.3","ZEBRA","590","Zebra Request"
"325","1.738559","10.0.3.1","192.138.1.3","ZEBRA","590","Zebra Request"
"326","1.738618","10.0.3.1","192.138.1.3","ZEBRA","590","Zebra Request"
"327","1.738677","10.0.3.1","192.138.1.3","ZEBRA","590","Zebra Request"
"328","1.738715","10.0.3.1","192.138.1.3","ZEBRA","374","Zebra Request"
"329","1.738753","192.138.1.3","10.0.3.1","TCP","54","2600  >  49153 [ACK] Seq=1 Ack=105537 Win=131072 Len=0 TSval=4738 TSecr=4690"
"330","1.739226","192.138.1.3","10.0.3.1","TCP","54","2600  >  49153 [ACK] Seq=1 Ack=106609 Win=131072 Len=0 TSval=4739 TSecr=4738"
"331","1.739823","192.138.1.3","10.0.3.1","TCP","54","2600  >  49153 [ACK] Seq=1 Ack=107681 Win=131072 Len=0 TSval=4739 TSecr=4738"
"332","1.786441","10.0.3.1","192.138.1.3","ZEBRA","590","Zebra Request"
"333","1.786500","10.0.3.1","192.138.1.3","ZEBRA","590","Zebra Request"
"334","1.786559","10.0.3.1","192.138.1.3","ZEBRA","590","Zebra Request"
"335","1.786618","10.0.3.1","192.138.1.3","ZEBRA","590","Zebra Request"
"336","1.786677","10.0.3.1","192.138.1.3","ZEBRA","590","Zebra Request"
"337","1.786715","10.0.3.1","192.138.1.3","ZEBRA","374","Zebra Request"
"338","1.788075","192.138.1.3","10.0.3.1","TCP","54","2600  >  49153 [ACK] Seq=1 Ack=108537 Win=131072 Len=0 TSval=4786 TSecr=4738"
"339","1.788110","192.138.1.3","10.0.3.1","TCP","54","2600  >  49153 [ACK] Seq=1 Ack=109609 Win=131072 Len=0 TSval=4787 TSecr=4786"
"340","1.788145","192.138.1.3","10.0.3.1","TCP","54","2600  >  49153 [ACK] Seq=1 Ack=110681 Win=131072 Len=0 TSval=4787 TSecr=4786"
"341","1.834441","10.0.3.1","192.138.1.3","ZEBRA","590","Zebra Request"
"342","1.834500","10.0.3.1","192.138.1.3","ZEBRA","590","Zebra Request"
"343","1.834559","10.0.3.1","192.138.1.3","ZEBRA","590","Zebra Request"
"344","1.834618","10.0.3.1","192.138.1.3","ZEBRA","590","Zebra Request"
"345","1.834677","10.0.3.1","192.138.1.3","ZEBRA","590","Zebra Request"
"346","1.834715","10.0.3.1","192.138.1.3","ZEBRA","374","Zebra Request"
"347","1.836468","192.138.1.3","10.0.3.1","TCP","54","2600  >  49153 [ACK] Seq=1 Ack=111537 Win=131072 Len=0 TSval=4834 TSecr=4786"
"348","1.836513","192.138.1.3","10.0.3.1","TCP","54","2600  >  49153 [ACK] Seq=1 Ack=112609 Win=131072 Len=0 TSval=4835 TSecr=4834"
"349","1.836548","192.138.1.3","10.0.3.1","TCP","54","2600  >  49153 [ACK] Seq=1 Ack=113681 Win=131072 Len=0 TSval=4835 TSecr=4834"
"350","1.882441","10.0.3.1","192.138.1.3","ZEBRA","590","Zebra Request"
"351","1.882500","10.0.3.1","192.138.1.3","ZEBRA","590","Zebra Request"
"352","1.882559","10.0.3.1","192.138.1.3","ZEBRA","590","Zebra Request"
"353","1.882618","10.0.3.1","192.138.1.3","ZEBRA","590","Zebra Request"
"354","1.882677","10.0.3.1","192.138.1.3","ZEBRA","590","Zebra Request"
"355","1.882715","10.0.3.1","192.138.1.3","ZEBRA","374","Zebra Request"
"356","1.882753","192.138.1.3","10.0.3.1","TCP","54","2600  >  49153 [ACK] Seq=1 Ack=114537 Win=131072 Len=0 TSval=4882 TSecr=4834"
"357","1.883243","192.138.1.3","10.0.3.1","TCP","54","2600  >  49153 [ACK] Seq=1 Ack=115609 Win=131072 Len=0 TSval=4883 TSecr=4882"
"358","1.883859","192.138.1.3","10.0.3.1","TCP","54","2600  >  49153 [ACK] Seq=1 Ack=116681 Win=131072 Len=0 TSval=4883 TSecr=4882"
"359","1.930441","10.0.3.1","192.138.1.3","ZEBRA","590","Zebra Request"
"360","1.930500","10.0.3.1","192.138.1.3","ZEBRA","590","Zebra Request"
"361","1.930559","10.0.3.1","192.138.1.3","ZEBRA","590","Zebra Request"
"362","1.930618","10.0.3.1","192.138.1.3","ZEBRA","590","Zebra Request"
"363","1.930677","10.0.3.1","192.138.1.3","ZEBRA","590","Zebra Request"
"364","1.930715","10.0.3.1","192.138.1.3","ZEBRA","374","Zebra Request"
"365","1.930753","192.138.1.3","10.0.3.1","TCP","54","2600  >  49153 [ACK] Seq=1 Ack=117537 Win=131072 Len=0 TSval=4930 TSecr=4882"
"366","1.931211","192.138.1.3","10.0.3.1","TCP","54","2600  >  49153 [ACK] Seq=1 Ack=118609 Win=131072 Len=0 TSval=4931 TSecr=4930"
"367","1.931714","192.138.1.3","10.0.3.1","TCP","54","2600  >  49153 [ACK] Seq=1 Ack=119681 Win=131072 Len=0 TSval=4931 TSecr=4930"
"368","1.978441","10.0.3.1","192.138.1.3","ZEBRA","590","Zebra Request"
"369","1.978500","10.0.3.1","192.138.1.3","ZEBRA","590","Zebra Request"
"370","1.978559","10.0.3.1","192.138.1.3","ZEBRA","590","Zebra Request"
"371","1.978618","10.0.3.1","192.138.1.3","ZEBRA","590","Zebra Request"
"372","1.978677","10.0.3.1","192.138.1.3","ZEBRA","590","Zebra Request"
"373","1.978715","10.0.3.1","192.138.1.3","ZEBRA","374","Zebra Request"
"374","1.978753","192.138.1.3","10.0.3.1","TCP","54","2600  >  49153 [ACK] Seq=1 Ack=120537 Win=131072 Len=0 TSval=4978 TSecr=4930"
"375","1.979199","192.138.1.3","10.0.3.1","TCP","54","2600  >  49153 [ACK] Seq=1 Ack=121609 Win=131072 Len=0 TSval=4979 TSecr=4978"
"376","1.979647","192.138.1.3","10.0.3.1","TCP","54","2600  >  49153 [ACK] Seq=1 Ack=122681 Win=131072 Len=0 TSval=4979 TSecr=4978"
"379","2.002225","192.138.1.3","192.138.2.3","IPv4","1502","Fragmented IP protocol (proto=UDP 17, off=0, ID=0001) [Reassembled in #380]"
"380","2.002580","192.138.1.3","192.138.2.3","UDP","1110","63  >  49153 Len=2560"
"381","2.026443","10.0.3.1","192.138.1.3","ZEBRA","590","Zebra Request"
"382","2.026502","10.0.3.1","192.138.1.3","ZEBRA","590","Zebra Request"
"383","2.026561","10.0.3.1","192.138.1.3","ZEBRA","590","Zebra Request"
"384","2.026620","10.0.3.1","192.138.1.3","ZEBRA","590","Zebra Request"
"385","2.026679","10.0.3.1","192.138.1.3","ZEBRA","590","Zebra Request"
"386","2.026717","10.0.3.1","192.138.1.3","ZEBRA","374","Zebra Request"
"387","2.026755","192.138.1.3","10.0.3.1","TCP","54","2600  >  49153 [ACK] Seq=1 Ack=123537 Win=131072 Len=0 TSval=5026 TSecr=4978"
"388","2.027297","192.138.1.3","10.0.3.1","TCP","54","2600  >  49153 [ACK] Seq=1 Ack=124609 Win=131072 Len=0 TSval=5027 TSecr=5026"
"389","2.027783","192.138.1.3","10.0.3.1","TCP","54","2600  >  49153 [ACK] Seq=1 Ack=125681 Win=131072 Len=0 TSval=5027 TSecr=5026"
"390","2.050624","192.138.2.2","192.138.1.1","IPv4","1502","Fragmented IP protocol (proto=UDP 17, off=0, ID=0000) [Reassembled in #392]"
"391","2.051072","192.138.2.2","192.138.1.1","IPv4","1502","Fragmented IP protocol (proto=UDP 17, off=1480, ID=0000) [Reassembled in #392]"
"392","2.051079","192.138.2.2","192.138.1.1","UDP","70","49153  >  2500 Len=3000"
"393","2.074443","10.0.3.1","192.138.1.3","ZEBRA","590","Zebra Request"
"394","2.074502","10.0.3.1","192.138.1.3","ZEBRA","590","Zebra Request"
"395","2.074561","10.0.3.1","192.138.1.3","ZEBRA","590","Zebra Request"
"396","2.074620","10.0.3.1","192.138.1.3","ZEBRA","590","Zebra Request"
"397","2.074679","10.0.3.1","192.138.1.3","ZEBRA","590","Zebra Request"
"398","2.074717","10.0.3.1","192.138.1.3","ZEBRA","374","Zebra Request"
"399","2.074755","192.138.1.3","10.0.3.1","TCP","54","2600  >  49153 [ACK] Seq=1 Ack=126537 Win=131072 Len=0 TSval=5074 TSecr=5026"
"400","2.075209","192.138.1.3","10.0.3.1","TCP","54","2600  >  49153 [ACK] Seq=1 Ack=127609 Win=131072 Len=0 TSval=5075 TSecr=5074"
"401","2.075670","192.138.1.3","10.0.3.1","TCP","54","2600  >  49153 [ACK] Seq=1 Ack=128681 Win=131072 Len=0 TSval=5075 TSecr=5074"
"402","2.096548","192.138.2.2","192.138.1.1","IPv4","1502","Fragmented IP protocol (proto=UDP 17, off=0, ID=0001) [Reassembled in #404]"
"403","2.097014","192.138.2.2","192.138.1.1","IPv4","1502","Fragmented IP protocol (proto=UDP 17, off=1480, ID=0001) [Reassembled in #404]"
"404","2.097021","192.138.2.2","192.138.1.1","UDP","70","49153  >  2500 Len=3000"
"405","2.122443","10.0.3.1","192.138.1.3","ZEBRA","590","Zebra Request"
"406","2.122502","10.0.3.1","192.138.1.3","ZEBRA","590","Zebra Request"
"407","2.122561","10.0.3.1","192.138.1.3","ZEBRA","590","Zebra Request"
"408","2.122620","10.0.3.1","192.138.1.3","ZEBRA","590","Zebra Request"
"409","2.122679","10.0.3.1","192.138.1.3","ZEBRA","590","Zebra Request"
"410","2.122717","10.0.3.1","192.138.1.3","ZEBRA","374","Zebra Request"
"411","2.122755","192.138.1.3","10.0.3.1","TCP","54","2600  >  49153 [ACK] Seq=1 Ack=129537 Win=131072 Len=0 TSval=5122 TSecr=5074"
"412","2.123217","192.138.1.3","10.0.3.1","TCP","54","2600  >  49153 [ACK] Seq=1 Ack=130609 Win=131072 Len=0 TSval=5123 TSecr=5122"
"413","2.123676","192.138.1.3","10.0.3.1","TCP","54","2600  >  49153 [ACK] Seq=1 Ack=131681 Win=131072 Len=0 TSval=5123 TSecr=5122"
"414","2.144548","192.138.2.2","192.138.1.1","IPv4","1502","Fragmented IP protocol (proto=UDP 17, off=0, ID=0002) [Reassembled in #416]"
"415","2.145016","192.138.2.2","192.138.1.1","IPv4","1502","Fragmented IP protocol (proto=UDP 17, off=1480, ID=0002) [Reassembled in #416]"
"416","2.145023","192.138.2.2","192.138.1.1","UDP","70","49153  >  2500 Len=3000"
"417","2.170443","10.0.3.1","192.138.1.3","ZEBRA","590","Zebra Request"
"418","2.170502","10.0.3.1","192.138.1.3","ZEBRA","590","Zebra Request"
"419","2.170561","10.0.3.1","192.138.1.3","ZEBRA","590","Zebra Request"
"420","2.170620","10.0.3.1","192.138.1.3","ZEBRA","590","Zebra Request"
"421","2.170679","10.0.3.1","192.138.1.3","ZEBRA","590","Zebra Request"
"422","2.170717","10.0.3.1","192.138.1.3","ZEBRA","374","Zebra Request"
"423","2.170755","192.138.1.3","10.0.3.1","TCP","54","2600  >  49153 [ACK] Seq=1 Ack=132537 Win=131072 Len=0 TSval=5170 TSecr=5122"
"424","2.171237","192.138.1.3","10.0.3.1","TCP","54","2600  >  49153 [ACK] Seq=1 Ack=133609 Win=131072 Len=0 TSval=5171 TSecr=5170"
"425","2.171685","192.138.1.3","10.0.3.1","TCP","54","2600  >  49153 [ACK] Seq=1 Ack=134681 Win=131072 Len=0 TSval=5171 TSecr=5170"
"426","2.192548","192.138.2.2","192.138.1.1","IPv4","1502","Fragmented IP protocol (proto=UDP 17, off=0, ID=0003) [Reassembled in #428]"
"427","2.192999","192.138.2.2","192.138.1.1","IPv4","1502","Fragmented IP protocol (proto=UDP 17, off=1480, ID=0003) [Reassembled in #428]"
"428","2.193006","192.138.2.2","192.138.1.1","UDP","70","49153  >  2500 Len=3000"
"429","2.218443","10.0.3.1","192.138.1.3","ZEBRA","590","Zebra Request"
"430","2.218502","10.0.3.1","192.138.1.3","ZEBRA","590","Zebra Request"
"431","2.218561","10.0.3.1","192.138.1.3","ZEBRA","590","Zebra Request"
"432","2.218620","10.0.3.1","192.138.1.3","ZEBRA","590","Zebra Request"
"433","2.218679","10.0.3.1","192.138.1.3","ZEBRA","590","Zebra Request"
"434","2.218717","10.0.3.1","192.138.1.3","ZEBRA","374","Zebra Request"
"435","2.219946","192.138.1.3","10.0.3.1","TCP","54","2600  >  49153 [ACK] Seq=1 Ack=135537 Win=131072 Len=0 TSval=5218 TSecr=5170"
